title,href,tag,summary
Race for vital supplies to reach volcano-hit Tonga,/news/world-asia-60046371,Asia,Teams work desperately to clear ash from runways so planes can deliver food and drinking water.
Backlash as US billionaire dismisses Uyghur abuse,/news/business-60045076,Business,
Skier investigated over collision with British girl,/news/world-europe-60036255,Europe,
Brighton further damage Chelsea's title hopes,/sport/football/59947190,Football,
The Spanish town 'lost in France',https://www.bbc.com/travel/article/20220117-aranese-spains-little-known-language,Travel,
Oil prices hit seven-year high after attack,/news/business-60044210,Business,An attack on fuel trucks in the Middle East and hopes for a global economic recovery have driven up prices.
Youngest ever president elected by EU Parliament,/news/world-europe-60035448,Europe,"Roberta Metsola, from Malta, was asked by journalists about her record of being anti-abortion."
'World's most valuable house' - which no one wanted to buy,/news/world-europe-60042021,Europe,"The BBC’s Rome correspondent Mark Lowen takes a look inside Villa Aurora, which failed to sell at auction."
Ghana dumped out of Afcon by Comoros,/sport/football/59947164,Football,Ghana suffer a humiliating group-stage exit at the Nations Cup as the four-time champions are beaten 3-2 by debutants Comoros.
No sprint races in 2022 'a possibility',/sport/formula1/60036659,Formula 1,"Formula 1 is in danger of not having any sprint events this year as a result of a stand-off over money, says McLaren boss Zak Brown."
Dortmund stunned by St Pauli in cup,/sport/football/60048223,European Football,Holders Borussia Dortmund are knocked out of the German Cup suffering a shock last-16 defeat by second division side St Pauli.
"Sweden's 'exceptional' 7,000-year-old burial comes to life",/reel/video/p0bhtslq/how-sweden-s-mysterious-seated-woman-came-to-life,,
The US lab working to revive the dead,/reel/video/p0bhkdp7/inside-the-lab-working-to-bring-people-back-from-the-dead,,
How to use brown fat to burn more calories,/reel/video/p097ylw3/is-exercising-in-the-cold-good-for-you-,,
The CV ageism that hurts workers,https://www.bbc.com/worklife/article/20220118-cv-ageism-can-you-be-the-wrong-age-for-a-job,Worklife,Both older and younger workers alike can fall victim to age-based judgement
The US city transformed by heartbreak,https://www.bbc.com/travel/article/20220117-st-louis-the-us-city-transformed-by-heartbreak,Travel,Tragedy and sorrow have been infused into the city's landscape
How Arctic kids learn resilience,https://www.bbc.com/future/article/20220105-the-arctic-parenting-style-that-fosters-resilience,Future,"To raise free-thinking kids, Sámi reindeer herders follow this age-old tradition"
What happens to fascist architecture?,https://www.bbc.com/culture/article/20220117-what-happens-to-fascist-architecture-after-fascism,Culture,"Across Europe, controversial monuments remain – what should happen to them?"
'Fussy eaters' could have post-Covid disorder,https://www.bbc.com/news/uk-england-norfolk-60024831,Health,"Experts write a guide on a taste and smell disorder, which they say can go undiagnosed in children"
'World first' vegan violin created using fruit,https://www.bbc.com/news/uk-england-hereford-worcester-60041471,UK,"Wild berries, steamed pear and local spring water have been used to create the instrument"
Remains found in cave near housing development,https://www.bbc.com/news/uk-england-devon-60042700,UK,"Campaigners say the site should be saved ""for future generations"""
The rhino that became an icon for peace,/future/article/20220111-the-rhinos-bringing-peace-in-india,,
The big question for lithium batteries,/future/article/20220105-lithium-batteries-big-unanswered-question,,
The new use for abandoned oil rigs,/future/article/20210126-the-richest-human-made-marine-habitats-in-the-world,,
China's Xi defends 'common prosperity' crackdowns,/news/business-60034050,Business,The Chinese leader made the comments during an address to the World Economic Forum’s annual...
"Plastic crisis needs binding treaty, report says",/news/science-environment-60026748,Science & Environment,
The row over Hong Kong's condemned hamsters,/news/world-asia-china-60038551,China,
The Apprentice contestant leaves on health grounds,/news/uk-england-leeds-60041827,Leeds & West Yorkshire,
Influencers called out over social media ads,/news/newsbeat-60040262,Newsbeat,
Supreme Court blocks Joe Biden's vaccine mandate,/news/world-us-canada-59989476,US & Canada,
Government says its climate change curbs inadequate,/news/science-environment-60026378,Science & Environment,
Celebrating creativity in the construction industry,/news/in-pictures-59952716,In Pictures,
Stunning Wolf Moon dazzles around the world,/news/in-pictures-60038631,In Pictures,
In pictures: Mourners line the streets for Ashling Murphy,/news/world-europe-60035626,Europe,
Italian fashion great Nino Cerruti dies aged 91,/news/uk-england-derbyshire-60011771,Europe,
Photographers flock to overflowing 'plug holes',/news/uk-england-derbyshire-59966942,Derby,
