title,href,tag,summary
Theranos founder Elizabeth Holmes jailed for fraud,/news/world-us-canada-63685131,US & Canada,Elizabeth Holmes - once one of Silicon Valley’s superstar CEOs - sentenced to 11 years in prison for defrauding investors with blood-testing start-up
Iranian protesters set fire to Khomeini's house,https://www.bbc.com/news/world-middle-east-63681472,Middle East,
Foie gras ban for King Charles's royal residences,https://www.bbc.com/news/uk-63676759,UK,
Twitter closes offices until next week,https://www.bbc.com/news/business-63672307,Business,
Is this the greatest taboo of all?,https://www.bbc.com/culture/article/20221117-bones-and-all-the-greatest-taboo-of-all,Culture,
Independent lawyer to oversee Trump investigations,/news/world-us-canada-63684546,US & Canada,The special counsel will ultimately decide whether to file criminal charges against the former president.
Why a war crimes expert will decide Trump cases,/news/world-us-canada-63685013,US & Canada,The attorney general has set in motion a whirlwind whose ultimate course will be difficult to predict.
Alcohol sales banned at World Cup stadiums in Qatar,/sport/football/63674631,Football,Alcohol will not be sold to fans at the World Cup's eight stadiums in Qatar after Fifa changes its policy two days before the start of the tournament.
Man Utd explore legal action to force Ronaldo exit,/sport/football/63676465,Football,Manchester United are exploring their legal options as they look to end Cristiano Ronaldo's time at the club.
"Lineker in Qatar to 'report, not support' World Cup",/sport/football/63680680,Football,"Gary Lineker says he is in Qatar to ""report, not support"" the World Cup and will discuss the issues surrounding the ""tainted"" tournament on air."
Halliwell leads England to World Cup final victory,/sport/rugby-league/63684590,Rugby League,Captain Tom Halliwell scores a late try to secure Wheelchair Rugby League World Cup success for England.
Michelle Obama: 'Fear is a powerful emotion',/reel/video/p0dh7wt4/michelle-obama-fear-is-a-powerful-emotion-,,
The world's most expensive nannies,/reel/video/p0chln6s/norland-college-the-world-s-most-expensive-nannies,,
The simple tricks for having a really good argument,/reel/video/p0cmk9tp/how-to-have-a-really-good-argument,,
The country giving up oil extraction,https://www.bbc.com/future/article/20221116-how-colombia-plans-to-keep-its-oil-and-gas-in-the-ground,Future,Colombia wants to keep its fossil fuels buried. Can it?
"The route of Jesus, Mary and Joseph",https://www.bbc.com/travel/article/20221116-holy-family-trail-a-new-path-though-egypts-holiest-sites,Travel,"The sacred location has produced untold ""miracles"", down to this day"
"'I regret the role, not my daughter'",https://www.bbc.com/worklife/article/20221111-what-is-maternal-ambivalence-and-why-it-matters,Worklife,Motherhood is hard – why do women face so much pressure to love it?
How to sleep well and be happy at home,https://www.bbc.com/culture/article/20221116-self-care-spaces-how-your-home-can-make-you-feel-good,Culture,A new approach to interior design is all about how our spaces make us feel
Rediscovered lost pigeon 'like finding a unicorn',https://www.bbc.com/news/world-asia-63672501,Asia,"Scientists say capturing footage of the black-naped pheasant-pigeon was ""a moment you dream about"""
Weekly quiz: What can't Mariah have for Christmas?,https://www.bbc.com/news/world-63656462,World,How closely have you been paying attention to the headlines?
Leprosy bacteria unexpectedly regenerate organs,https://www.bbc.com/news/health-63626239,Health,"Bacteria that cause leprosy are shown to safely grow and regenerate the liver, in animal experiments"
The doctors prescribing 'blue' therapy,/future/article/20221108-the-doctors-prescribing-blue-therapy,,
The world's first sand battery,/future/article/20221102-how-a-sand-battery-could-transform-clean-energy,,
"The worst drought in 1,200 years",/future/article/20221031-how-tucson-arizona-is-facing-up-to-a-1200-year-drought,,
Taylor Swift ticket sale cancelled amid high demand,/news/business-63652665,Business,Tickets to see Taylor Swift live in concert sold so swiftly the general public never even had a...
Millie Gibson cast as new Doctor Who companion,/news/entertainment-arts-63675140,Entertainment & Arts,
Climate summit runs over as talks hit gridlock,/news/science-environment-63677463,Science & Environment,
New FTX boss condemns crypto firm's failure,/news/technology-63662396,Technology,
"Excruciating to see ticket sale chaos, says Swift",/news/entertainment-arts-63679936,Entertainment & Arts,
Women footballers face boot injury risk - study,/news/health-63636201,Health,
'Landmark vote' gives boost to threatened sharks,/news/science-environment-63670072,Science & Environment,
"Africa's top shots: Silk, beads and gold beauty queens",/news/world-africa-63661322,Africa,
Inside the floating polar research laboratory,/news/uk-england-essex-63628208,Essex,
"Africa's top shots: Bullseye, birds and ballet",/news/world-africa-63542247,Africa,
Lensman recaptures city pub scenes 40 years on,/news/uk-england-humber-63549572,Humberside,
Stunningly preserved bronze statues found in Italy,/news/world-europe-63564404,Europe,
