title,href,tag,summary
Victory is inevitable if allies keep promises - Zelensky,/news/live/world-europe-64750118,Europe,"As the first German-made tanks arrive in Ukraine, President Zelensky urges allies to stick to their promises and deadlines."
Why China launched a charm offensive over Ukraine,https://www.bbc.com/news/world-asia-china-64754510,China,
"Ohio toxic train crash killed nearly 45,000 animals",https://www.bbc.com/news/world-us-canada-64749041,US,
Swimmers 'ruined' by fat-shaming and bullying,https://www.bbc.com/news/uk-england-64256659,England,
Why borsch transcends soup,https://www.bbc.com/travel/article/20230223-vegetarian-borsch-with-vushka-dumplings,Travel,
US towns in the dark when toxic trains roll past,/news/world-us-canada-64750378,US & Canada,East Palestine residents didn't know about the toxins passing their homes daily. They aren't alone.
Los Angeles sees first blizzard warning since 1989,/news/world-us-canada-64753583,US & Canada,"The major throughway, Interstate 5, is now closed in California due to intensifying weather."
Rebellious Andean bear sneaks out of US zoo - twice,/news/world-us-canada-64762959,US & Canada,The South American species escaped his habitat at the St Louis Zoo for the second time this month.
Premier League: Build-up to Fulham v Wolves,/sport/live/football/63892804,Football,Follow live text commentary from Fulham v Wolverhampton Wanderers in the Premier League.
"'We will not forgive, or forget' - six sporting lives lost in Ukraine",/sport/64641089,Sport,Numerous Ukrainian sportspeople signed up to fight after Russia invaded a year ago. Not all those who swapped the sports field for the battlefield have survived the conflict.
England out of T20 World Cup as SA win semi-final,/sport/cricket/64759605,Sport,England are knocked out of the Women's T20 World Cup after inspired hosts South Africa win a gripping semi-final by six runs.
Why Putin considers Ukraine 'his backyard',/reel/video/p0f51d2c/why-putin-considers-ukraine-his-backyard-,,
Will we ever solve the biggest secret in the Universe?,/reel/video/p0f4w17x/dark-matter-the-underground-lab-unlocking-the-universe,,
The simple diet change that will boost your memory,/reel/video/p0df5vpt/what-food-and-drink-is-good-for-your-memory-,,
11 of the best films to watch in March,https://www.bbc.com/culture/article/20230223-11-of-the-best-films-to-watch-in-march,Culture,"Dungeons & Dragons, Creed III and the latest John Wick"
The university that changed the world,https://www.bbc.com/travel/article/20230222-nalanda-the-university-that-changed-the-world,Travel,"It revolutionised how we think about math, astronomy and religion"
Ukraine's mental health first aiders,https://www.bbc.com/future/article/20230222-ukraine-war-how-mental-health-first-aid-ca-prevent-ptsd,Future,"'It is not just a war of physical aggression, but also on mental health'"
The Gen Z friendship problem,https://www.bbc.com/worklife/article/20230201-can-gen-z-make-friends-in-the-pandemic-era,Worklife,Why young adults are struggling to make friends – and needing to get creative
Two million air fryers recalled over burn hazard,https://www.bbc.com/news/world-us-canada-64752726,US & Canada,Cosori has received reports of air fryers catching fire and causing minor burns and property damage
Netflix cuts prices in more than 30 countries,https://www.bbc.com/news/business-64753499,Business,"The company has faced growing competition from rivals including Amazon, HBO and Disney"
How Putin's fate is tied to his war in Ukraine,https://www.bbc.com/news/world-europe-64744197,Europe,Steve Rosenberg looks at why Vladimir Putin set sail in a storm of his own making a year ago
How longer weekends help the planet,/future/article/20230220-is-a-4-day-workweek-good-for-the-climate,,
Can the unborn have a say on climate?,/future/article/20230215-should-future-generations-have-climate-rights,,
The cities built to be reusable,/future/article/20230207-can-we-design-cities-for-disassembly,,
Firm calls for new apprenticeship in phone repair,/news/technology-64704104,Technology,Repair firm says there is no industry standard training for fixing smartphones and other devices.
Vernon Kay to replace Ken Bruce on Radio 2,/news/entertainment-arts-64755872,Entertainment & Arts,
UK makes contingency plans over bird flu,/news/health-64763625,Health,
England's history gathers dust as museums fill up,/news/science-environment-64707488,Science & Environment,
Cambodian girl dies in rare bird flu case,/news/world-asia-64754462,Asia,
TikTok under investigation by Canadian privacy authorities,/news/technology-64759365,Technology,
Vigils and flags: Ukraine war anniversary in pictures,/news/in-pictures-64757068,In Pictures,
The 24-year photography project,/news/in-pictures-64723755,In Pictures,
Outlaw-themed parade triumphs at Rio carnival,/news/world-latin-america-64742729,Latin America & Caribbean,
"Chukkas, cats and candles: Africa's top shots",/news/world-africa-64726122,Africa,
Ten photos before Ukrainian lives changed forever,/news/world-europe-64695153,Europe,
England's Big Picture: Images of the nation,/news/uk-england-64698563,England,
