title,href,tag,summary
Security ramped up ahead of Trump court appearance,/news/world-us-canada-66388176,US & Canada,The ex-president will appear in court on Thursday accused of plotting to overturn the 2020 election.
Women's World Cup: South Korea v Germany,https://www.bbc.com/sport/live/football/65582982,Football,
India victims count losses after deadly clashes,https://www.bbc.com/news/world-asia-india-66391587,India,
The clothing that keeps you cool,https://www.bbc.com/future/article/20230802-what-is-the-best-clothing-to-keep-you-cool,Future,
11 of the best TV shows to watch in August,https://www.bbc.com/culture/article/20230802-11-of-the-best-tv-shows-to-watch-in-august,Culture,
North Korea confirms custody of US soldier,/news/world-asia-66391573,Asia,Travis King dashed across the border to North Korea from the South in July.
Lizzo dancer claims others are scared to speak,/news/entertainment-arts-66384971,Entertainment & Arts,The US pop star is being sued for sexual harassment and fat-shaming but has yet to comment.
Canada PM Justin Trudeau and wife Sophie separate,/news/world-us-canada-66389069,US & Canada,"Justin Trudeau and his wife Sophie split after 18 years, following ""meaningful and difficult conversations""."
"Transfer latest, Chelsea tour news & Brady invests in Birmingham",/sport/live/football/66391835,Football,"Manchester City agree a £77m fee for Josko Gvardiol, NFL legend Tom Brady invests in Birmingham City and reports suggest Kylian Mbappe is open to joining Chelsea on loan."
Pochettino hopes Nkunku injury is not 'big issue',/sport/football/66391789,Football,"Boss Mauricio Pochettino hopes striker Christopher Nkunku's injury is not a ""big issue"" after Chelsea draw 1-1 with Borussia Dortmund."
England beat Australia in World Cup thriller,/sport/netball/66393291,Netball,England hold their nerve to beat Australia for the first time at a Netball World Cup and finish top of Pool F in South Africa.
Women's World Cup: Morocco v Colombia,https://www.bbc.com/sport/live/football/66157596,Football,Follow live text updates as Morocco face Colombia in Group H
'You have no idea' - Horan responds to USA critics,https://www.bbc.com/sport/football/66391098,Football,"Criticism of USA's displays at the Women's World Cup is ""noise"", says captain Lindsey Horan"
James 'not surprised' by daughter Lauren's impressive form,https://www.bbc.com/sport/football/66385871,Football,Lauren James has become an overnight sensation but dad Nigel tells BBC Sport he is not surprised at her success
"46,000-year-old worms from Siberian permafrost come back to life",/reel/video/p0g4fxxt/ancient-worms-found-in-siberia-permafrost-come-back-to-life,,
The curious species holding the secret to a longer life,/reel/video/p0g4174s/is-this-mysterious-animal-the-key-to-human-longevity-,,
Skeleton reveals early humans had sex with Neanderthals,/reel/video/p0f8khzt/lapedo-child-a-neanderthal-modern-human-hybrid-,,
The drink thought to fight heatstroke,https://www.bbc.com/travel/article/20230802-kokum-indias-naturally-cooling-fruit-juice,World's Table,It's traditionally considered a natural coolant for beating the summer heat
The monster shark of prehistoric Earth,https://www.bbc.com/future/article/20230801-megalodon-the-superpredator-that-ate-its-siblings-in-the-womb,Future,The leviathan that ate its siblings in the womb
Why Angus Cloud was so captivating,https://www.bbc.com/culture/article/20230801-how-angus-clouds-remarkable-euphoria-performance-showed-a-star-was-born,Culture,"How the young actor, who died yesterday, captivated on screen"
NZ's most authentic tourist experience?,https://www.bbc.com/travel/article/20230801-kohutapu-lodge-a-model-for-regenerative-tourism-in-new-zealand,Travel,A family-owned business is flipping the script on Indigenous tourism
"The Great Resignation is over, say experts",https://www.bbc.com/worklife/article/20230731-the-great-resignation-is-over-what-does-that-mean,Worklife,The end of a very important era is here – what does that mean?
Was this the heaviest ever animal on Earth?,https://www.bbc.co.uk/news/science-environment-66384632,Science & Environment,"An ancient, long-extinct whale could have tipped the scales at close to 200 tonnes, scientists say"
Somalia sorry for fielding record slow sprinter,https://www.bbc.com/news/world-africa-66387994,Africa,An official apologised after the runner took almost twice as long as the winner to finish
The US states pre-empting floods,/future/article/20230731-climate-adaptation-how-us-is-preparing-for-extreme-floods,,
The Scottish village reviving a loch,/future/article/20230725-seawilding-the-scottish-community-reviving-a-loch,,
What if we stopped all fishing?,/future/article/20230721-what-would-happen-if-we-stopped-fishing,,
How Heartstopper helped older fan open up on sexuality,/news/entertainment-arts-66223980,Entertainment & Arts,The Netflix show may be aimed at teens but it has a special appeal for some older fans.
Photographer catches 'once in a lifetime' picture,/news/uk-england-cornwall-66332656,Cornwall,
Why you should always go to sleep at the same time,/news/health-66372087,Health,
When Bollywood A-listers turn into start-up stars,https://www.bbc.com/news/world-asia-india-66335648,Business,
Radio 2 loses a million listeners after Bruce exit,/news/entertainment-arts-66381610,Entertainment & Arts,
Kenya halts Worldcoin amid clamour for free money,/news/world-africa-66383325,Africa,
Nasa picks up 'heartbeat' signal from lost space probe,/news/world-66371569,Science & Environment,
"Water, fire and oceans: Africa’s top shots",/news/world-africa-66323739,Africa,
Sinéad O'Connor: Fans mourn in London and Dublin,/news/in-pictures-66333764,In Pictures,
Sinéad O'Connor: Life in pictures,/news/in-pictures-66323955,In Pictures,
In Pictures: Wildfires in Europe and North Africa,/news/in-pictures-66289156,In Pictures,
See Africa unmasked through its own lens,/news/world-africa-66257772,Africa,
