title,href,tag,summary
Theranos founder Elizabeth Holmes guilty of fraud,/news/world-us-canada-59734254,US & Canada,A jury found the Silicon Valley ex-CEO guilty on four of 11 counts after seven days of deliberations.
The rise and fall of Elizabeth Holmes,/news/business-59863739,Business,
'I was just so happy to survive' - Hassan,https://www.bbc.com/sport/athletics/59848002,Athletics,
The surprising upsides of bad moods,https://www.bbc.com/future/article/20211214-the-surprising-upsides-of-foul-moods,Future,
The UK's most challenging road?,https://www.bbc.com/travel/article/20211213-the-hardknott-pass-britains-wildest-road,Travel,
Andrew accuser’s 2009 deal with Epstein published,/news/uk-59861831,UK,"It shows Virginia Giuffre agreed not to sue anyone who could be described as a ""potential defendant""."
What's Tony Blair's new title? Our timed quiz...,/news/world-us-canada-59858150,US & Canada,"Test your knowledge of the news these last few days - 10 questions, 10 seconds each. Go!"
Tesla criticised after opening Xinjiang showroom,/news/business-59863859,Business,The world's most valuable car maker opened the new showroom in the city of Urumqi on New Year's Eve.
Reaction to Wolves' win at Man Utd & transfer latest,/sport/live/football/59865182,Football,Reaction to Wolverhampton Wanderers' win over Manchester United at Old Trafford and January transfer news latest.
'I didn't think we were all together',/sport/football/59863242,Football,BBC Sport's Simon Stone takes a closer look at a miserable night for Manchester United after a 1-0 defeat to Wolves.
Broad returns to England XI in Sydney,/sport/cricket/59863563,Cricket,"Bowler Stuart Broad is recalled by England for the fourth Ashes Test against Australia in Sydney, replacing Ollie Robinson."
Polybius: The most dangerous arcade game ever made?,/reel/video/p0bf52h9/polybius-the-most-dangerous-arcade-game-ever-made-,,
Is a vegan diet healthier than eating meat and dairy?,/reel/video/p0b5x2z7/is-a-vegan-diet-healthier-than-eating-meat-and-dairy-,,
The forbidden erotica of ancient Pompeii,/reel/video/p09xtq4m/the-forbidden-erotica-of-ancient-pompeii,,
Why the tiny house is perfect for now,https://www.bbc.com/culture/article/20211215-why-the-tiny-house-movement-is-big,Culture,How minuscule dwellings are changing the way we think about home and community
The myth of the 'new normal' in 2022,https://www.bbc.com/worklife/article/20220104-future-of-work-2022,Worklife,Why we need to 'stop looking for a crystal ball' this year
The one question all Koreans ask,https://www.bbc.com/travel/article/20211214-where-asking-someones-age-isnt-rude,Travel,It's a social contract that establishes the hierarchy between speakers
What was sex with a Neanderthal like?,https://www.bbc.com/future/article/20210112-heres-what-sex-with-neanderthals-was-like,Future,The archaeological record is surprisingly rich with salacious details
Is another storm brewing in Silicon Valley?,https://www.bbc.com/news/technology-58469882,Technology,Could a Theranos scandal happen again or has Silicon Valley learnt its lesson?
Sound of 2022: Mimi Webb is making songs to break up to,/news/entertainment-arts-59733287,Entertainment & Arts,"Inspired by Adele, the singer's emotionally-charged music even led to the end of her own..."
Israel may hit herd immunity but at a price - adviser,/news/world-middle-east-59853772,Middle East,Health boss says Omicron may lead to herd immunity but it would be better achieved via vaccination.
The new use for abandoned oil rigs,/future/article/20210126-the-richest-human-made-marine-habitats-in-the-world,,
The sector behind a third of our waste,/future/article/20211215-the-buildings-made-from-rubbish,,
The new weapon against climate change,/future/article/20211207-the-legal-battle-against-climate-change,,
Bowie estate sells rights to entire body of work,/news/entertainment-arts-59860096,Entertainment & Arts,"Warner Chappell Music say they are ""immensely proud"" to be ""chosen as caretakers""."
Why BlackBerry held the tiny keys to my heart,/news/technology-59859817,Technology,
James Webb telescope: Everything is 'hunky dory',/news/science-environment-59863092,Science & Environment,
Is there a better way to make new resolutions stick?,https://www.bbc.co.uk/news/business-59696196,Business,
WHO chief optimistic about beating Covid in 2022,/news/world-59840513,World,
UAE citizens to need booster jab to travel abroad,/news/world-middle-east-59845833,Middle East,
The fossil expert who left his own footprint behind,/news/world-africa-59833131,Africa,
Astronomer hones star photo skills in lockdown,/news/uk-england-cambridgeshire-59820361,Cambridgeshire,
Photographer captures unique bird spoon image,/news/world-middle-east-59748062,Middle East,
Africa's top shots of 2021: Giggles and coronations,/news/world-africa-59703122,Africa,
Legend of street photography Sabine Weiss dies at 97,/news/world-europe-59816052,Europe,
Berlin Zoo animals feast on unsold Christmas trees,/news/world-europe-59823632,Europe,
