title,href,tag,summary
Blinken and Lavrov meet for first time since invasion,/news/world-asia-india-64825198,India,The top US diplomat Antony Blinken tells his Russian counterpart the US will keep supporting Ukraine.
Explosive found in check-in luggage at US airport,https://www.bbc.com/news/world-us-canada-64819964,US,
Harry and Meghan told to 'vacate' Frogmore Cottage,https://www.bbc.com/news/uk-64815383,UK,
The greatest monster film ever made,https://www.bbc.com/culture/article/20230301-king-kong-at-90-the-greatest-monster-film-ever-made,Culture,
The little-known history of Champagne,https://www.bbc.com/travel/article/20230301-the-little-known-history-of-champagne,Travel,
Bitter divisions hamper search for Covid origins,/news/world-us-canada-64819965,US & Canada,"It should be no surprise that US agencies cannot agree, given how toxic the debate has become."
Californians snowed in by winter storm surge,/news/world-us-canada-64821309,US & Canada,"Rescue crews are scrambling to dig out residents before roofs collapse, while Yosemite National Park is closed."
1894 shipwreck confirms tale of treacherous lifeboat,/news/world-us-canada-64819156,US & Canada,"The Ironton yields a secret, jealously guarded until now by the deep, about the sailors' demise."
Yorkshire racism hearing - Rafiq cross-examined,/sport/live/cricket/64787521,Cricket,"Follow live as day two of the Cricket Discipline Commission hearing into racism at Yorkshire CCC gets under way in London, with Azeem Rafiq giving evidence."
Premier League news conferences & greatest FA Cup moments,/sport/live/football/64820932,Football,Grimsby and Sheffield United provide the FA Cup fifth-round shocks while Arsenal lay another marker down in the Premier League title race with four goals against Everton.
Australia close on victory as India all out for 163,/sport/cricket/64826777,Cricket,Australia need just 76 runs from their second innings to win the third Test against India and secure their place in the World Test Championship final.
What science tells us about the afterlife,/reel/video/p0f61ch8/why-are-humans-obsessed-with-the-afterlife-,,
Huldufólk: The invisible elves of Iceland,/reel/video/p0f5xqv0/hulduf-lk-iceland-s-mythical-world-of-hidden-people,,
The shocking legacy of the Dutch 'Hunger Winter',/reel/video/p0f5qzdq/the-harmful-legacy-of-poor-nutrition,,
The 1991 video game phenomenon,https://www.bbc.com/culture/article/20230228-street-fighter-ii-the-1991-video-game-that-packs-a-punch,Culture,Street Fighter II's unique cultural reach
The return of the US' lost language,https://www.bbc.com/travel/article/20230228-kouri-vini-the-return-of-the-us-lost-language,Travel,"There are fewer than 6,000 speakers left"
The problem confronting women of colour,https://www.bbc.com/worklife/article/20230228-the-perfect-storm-keeping-women-of-colour-behind-at-work,Worklife,There’s a story hidden in the recent workplace changes for women
Why trees are being stolen for firewood,https://www.bbc.com/future/article/20230301-the-complex-problem-of-firewood-theft,Future,"In many countries, trees are vanishing from woodland and forests overnight"
"Too late to save planet, says Green Party founder",https://www.bbc.com/news/uk-politics-64815875,UK Politics,Michael Benfield says the situation is very dire
Same-sex marriage ban not discrimination - Japan PM,https://www.bbc.com/news/world-asia-64820191,Asia,Fumio Kishida is facing criticism for his remarks
How 10% of Nigerian registered voters delivered victory,https://www.bbc.com/news/world-africa-64808775,Africa,President-elect Bola Tinubu can thank an opposition split for paving his way to the presidency
The clothes you can't recycle,/future/article/20230227-how-to-recycle-your-clothes,,
How longer weekends help the planet,/future/article/20230220-is-a-4-day-workweek-good-for-the-climate,,
Can the unborn have a say on climate?,/future/article/20230215-should-future-generations-have-climate-rights,,
Covid origin likely China lab incident - FBI chief,/news/world-us-canada-64806903,US & Canada,Other US agencies have come to different conclusions from the FBI on how the pandemic began.
Pictures show devastation after Greece train disaster,/news/world-europe-64808123,Europe,
Twitch streamer Kai Cenat breaks subscriber record,/news/technology-64811710,Technology,
Guilt-free flying not in easy reach - scientists,/news/science-environment-64788106,Science & Environment,
Chinese factories boom while Japan's are in reverse,/news/business-64807491,Business,
What is carbon capture and can it fight climate change?,/news/science-environment-64723497,Science & Environment,
Eurovision tickets to go on sale next week,/news/entertainment-arts-64784428,Entertainment & Arts,
Spectacular northern lights seen across UK,/news/uk-64782372,UK,
SAG Awards: The red carpet in pictures,/news/entertainment-arts-64781316,Entertainment & Arts,
Vigils and flags: Ukraine war anniversary in pictures,/news/in-pictures-64757068,In Pictures,
The 24-year photography project,/news/in-pictures-64723755,In Pictures,
Outlaw-themed parade triumphs at Rio carnival,/news/world-latin-america-64742729,Latin America & Caribbean,
