title,href,tag,summary
Seven dead as car hits people in Texas border town,/news/world-us-canada-65521233,US & Canada,The driver has been arrested and police say it is not yet clear if the incident was intentional.
Wagner 'promised ammunition' after retreat threat,/news/world-europe-65516633,Europe,
'Mad panic' as Russia evacuates nuclear plant town,/news/world-europe-65515443,Europe,
Texas mall shooter identified by US media,/news/world-us-canada-65521656,US & Canada,
Verstappen beats Perez to Miami victory - reaction,/sport/live/formula1/63206802,Formula 1,
Take That and Katy Perry bring Coronation concert to a close,/news/live/uk-65474716,UK,King Charles and other royals were on their feet for a rousing finale to the show at Windsor Castle.
Canadian province declares wildfire emergency,/news/world-us-canada-65515446,US & Canada,"More than 100 wildfires rage in the western province of Alberta and 25,000 people are evacuated."
One governor's blueprint that could challenge Trump,/news/world-us-canada-65464667,US & Canada,"Republican Governor Ron DeSantis has transformed Florida, but can he export his vision nationally?"
De Gea blunder hands West Ham win,/sport/football/65439740,Football,A howler from David de Gea gifts West Ham victory over Manchester United to boost their chances of Premier League survival.
Verstappen extends title lead with Miami victory,/sport/formula1/65521789,Formula 1,Red Bull's Max Verstappen carves through the field to win the Miami Grand Prix from ninth place on the grid.
How Arsenal documentary inspired win at Newcastle,/sport/football/65521551,Football,Arsenal's journey from also-rans into serious Premier League title contenders can be clearly illustrated by two games on Tyneside separated by almost 12 months.
Five little-known Coronation facts to impress your friends,/reel/video/p0flpz2n/five-little-known-coronation-facts-to-impress-your-friends,,
A misunderstood ancient erotic manual,/reel/video/p0fl4b21/kama-sutra-a-misunderstood-ancient-erotic-manual,,
Why do French men pee on the street?,/reel/video/p0fg8f6z/why-do-french-men-pee-on-the-street-,,
Six extraordinary gardens around the world,https://www.bbc.com/culture/article/20230505-five-extraordinary-gardens-around-the-world,The Collection,"From a warm, lush haven of native plants to a wind-swept shoreline patch"
The jobs AI won't take yet,https://www.bbc.com/worklife/article/20230507-the-jobs-ai-wont-take-yet,Worklife,AI will be able to replace some workers – but computers won't overtake all
12 TV series to watch this May,https://www.bbc.com/culture/article/20230504-12-of-the-best-tv-shows-to-watch-this-may,Culture,From Bridgerton prequel Queen Charlotte to an Arnold Schwarzenegger action show
The rebirth of British folk culture,https://www.bbc.com/travel/article/20230507-the-london-venue-reimagining-british-music,Travel,It's questioning the very notion of what traditional British music is
Do you own too many clothes?,https://www.bbc.com/future/article/20230502-how-to-make-your-wardrobe-sustainable,Future,The 'sufficient' wardrobe
Vietnam records highest-ever temperature of 44.1C,https://www.bbc.com/news/world-asia-65518528,Asia,One farmer said the fierce heat meant people had to finish work by 10 o'clock in the morning
"US recalls 500,000 Covid tests over bacteria risk",https://www.bbc.com/news/world-us-canada-65503664,US,The FDA said the liquid solution in some Pilot Covid-19 At-Home Tests may pose safety concerns
What 1.5C living actually looks like,/future/article/20230504-the-people-living-ultra-low-carbon-lifestyles,,
The revival of a historic Italian fruit,/future/article/20230424-how-agrivoltaics-helped-save-italys-citron-and-lemon-trees,,
The first climate-resilient nation?,/future/article/20230418-how-caribbean-island-dominica-is-fighting-climate-impacts,,
"Pa, we are all so proud of you, says William",/news/entertainment-arts-65480420,UK,"The Prince of Wales says Queen Elizabeth II would be a ""proud mother"" as he praises his father King..."
In pictures: Eurovision stars hit turquoise carpet,/news/entertainment-arts-65497594,Entertainment & Arts,
Banks warn of big increase in online scams,/news/technology-65486219,Technology,
"Covid global health emergency is over, WHO says",/news/health-65499929,Health,
In pictures: Royal superfans camp out ahead of Coronation,/news/in-pictures-65484438,In Pictures,
Animal tests for makeup resume after 25-year ban,/news/science-environment-65484552,Science & Environment,
North Carolina lawmakers pass 12-week abortion ban,/news/world-us-canada-65489803,US & Canada,
Stylish singers and snipers: Africa's top shots,/news/world-africa-65480076,Africa,
In pictures: Night-time Coronation rehearsal,/news/in-pictures-65467802,In Pictures,
The 17 most eye-catching looks at the Met Gala,/news/entertainment-arts-65413976,Entertainment & Arts,
Parasols and prayers: Africa's top shots,/news/world-africa-65409697,Africa,
The photos that chronicle the cost of dying,/news/uk-scotland-65354687,Scotland,
