title,href,tag,summary
Eighth wave of Russian missiles hits Ukraine,/news/world-europe-63863138,Europe,The latest strikes on Ukrainian infrastructure may have caused less damage than previous attacks.
Dazzling Brazil dismantle South Korea in last 16,https://www.bbc.com/sport/football/63777438,World Cup,
Top US court weighs gay rights v free speech,https://www.bbc.com/news/world-us-canada-63863417,US,
The life that colonised the cold,https://www.bbc.com/future/article/20221202-the-rich-marine-life-under-frozen-ice,Future,
The workers lured into oversold jobs,https://www.bbc.com/worklife/article/20221202-the-workers-lured-into-oversold-jobs,Worklife,
Inside the capital taken hostage by brutal gangs,/news/world-latin-america-63707429,Latin America & Caribbean,"Orla Guerin reports from Port-au-Prince, where Haitians live in fear of killings, kidnappings and rape."
Idaho roommates break silence over murdered friends,/news/world-us-canada-63863418,US & Canada,"The two slept through the attack, during which four of their friends were murdered."
The 'soft girl' trend that millennials love,https://www.bbc.com/culture/article/20221202-soft-girl-what-it-really-means-to-lead-a-soft-life,News,"Why did the 'soft girl' trend, sparked by Nigerian influencers, resonate with black women worldwide?"
'Raid of Rawalpindi makes believers of us all',/sport/cricket/63856468,Cricket,"If there were any lingering doubts, England's first-Test win against Pakistan fully vindicates the philosophy of Ben Stokes and Brendon McCullum, writes Stephan Shemilt"
Croatia beat Japan on penalties to reach quarters,/sport/football/63777439,Football,"Goalkeeper Dominik Livakovic is the hero, saving three penalties in the shootout, as Croatia edge past Japan with a 3-1 victory to reach the World Cup quarter-finals."
Saudi Arabia's Al-Nassr make offer for Ronaldo,/sport/football/63862054,Football,Saudi Arabian club Al-Nassr make an offer to sign Cristiano Ronaldo after the World Cup.
'How I forgave myself for accidently killing my friend',/reel/video/p0cs4ksz/-how-i-forgave-myself-for-the-death-of-my-friend-,,
The 'invisible' Soviet town that suddenly appeared on the map,/reel/video/p09zf8v2/the-invisible-soviet-town-that-suddenly-appeared-in-poland,,
The mysterious 'inverted tower' steeped in Templar myth,/reel/video/p07r1cbm/the-mysterious-inverted-tower-steeped-in-templar-myth,,
The city that loves to be rude,https://www.bbc.com/travel/article/20221205-berlins-beloved-and-loathed-local-dialect,Travel,Locals see it as a quick-witted linguistic game
The Alpine villages powered by streams,https://www.bbc.com/future/article/20221129-the-alpine-villages-producing-their-own-power,Future,Mountain streams are helping make Alpine villages energy self-sufficient
How Top Gun: Maverick shocked the world,https://www.bbc.com/culture/article/20221201-how-top-gun-maverick-shocked-the-world,Culture,Why the Tom Cruise blockbuster sequel became the mega-hit that nobody predicted
The misery of middle managers,https://www.bbc.com/worklife/article/20221123-how-flexibility-made-managers-miserable,Worklife,"How the shift to flexibility created ""a recipe for stress and burnout"""
Word of the year 2022 named by Oxford,https://www.bbc.com/news/uk-63857329,UK,A landslide public vote chooses the 2022 word of the year from options prepared by lexicographers
"It's a dirty game, says Harry in new trailer",https://www.bbc.com/news/uk-63861642,UK,"Prince Harry describes the ""pain and suffering of women marrying into"" the Royal Family in a new..."
Five ways to spend and waste less this Christmas,https://www.bbc.com/news/business-63796498,Business,Experts give tips on how to make your Christmas cheaper and greener
Should air miles schemes be scrapped?,/future/article/20221122-should-we-get-rid-of-air-miles-for-climate-change,,
The floating solar revolution,/future/article/20221116-the-floating-solar-panels-that-track-the-sun,,
The doctors prescribing 'blue' therapy,/future/article/20221108-the-doctors-prescribing-blue-therapy,,
"Flo, Cat Burns and Gabriels tipped as Sound Of 2023",/news/entertainment-arts-63809715,Entertainment & Arts,"Girl band Flo, pop singer Cat Burns and dance act Piri & Tommy are all tipped for success in 2023."
Nasa's Orion spacecraft is homeward-bound,/news/science-environment-63866949,Science & Environment,
'Tech layoffs won't destroy American dreams of Indians’,/news/world-asia-india-63804055,India,
Strep A: Why it can be dangerous and what to know,/news/health-63836093,Health,
Neil Diamond surprises with 'Sweet Caroline' singalong,/news/world-us-canada-63840737,US & Canada,
US created distortions with climate bill - EU chief,/news/world-europe-63852394,Europe,
Construction to begin on world's biggest telescope,/news/science-environment-63836496,Science & Environment,
The photographer who puts little people in the frame,/news/uk-scotland-63781000,Scotland,
Africa's top shots: Dripping diamonds and football fever,/news/world-africa-63819552,Africa,
In Pictures: Mauna Loa erupts,/news/in-pictures-63820551,In Pictures,
The photographer who preserved rural Indian life,/news/world-asia-india-63705190,India,
'Photography helps me manage my PTSD',/news/uk-england-essex-63699954,Essex,
