title,href,tag,summary
Insurgents defeated after rare border raid - Russia,/news/world-europe-65683374,Europe,Russia claims to have defeated insurgents who crossed the border from Ukraine to launch attacks near Belgorod.
Intercepting Russian 'Zombies' at a Nato airbase,https://www.bbc.com/news/world-europe-65673272,Europe,
Why DeSantis's risky feud with Disney may pay off,https://www.bbc.com/news/world-us-canada-65676131,US,
The 'flawed' skill that shaped history,https://www.bbc.com/future/article/20230518-foresight-the-mental-talent-that-shaped-the-world,Future,
The number one children's book revealed,https://www.bbc.com/culture/article/20230522-where-the-wild-things-are-the-best-childrens-book-ever,Culture,
Canada inquiry into election meddling ruled out,/news/world-us-canada-65688455,US & Canada,A report instead recommends public hearings into claims China tried to meddle in Canadian politics.
Prince Harry loses challenge to pay for security,/news/uk-65609209,UK,"The Home Office says wealthy individuals should not be able to ""buy"" security from the police."
France bans short-haul flights to cut CO2,/news/world-europe-65687665,Europe,All domestic air routes are stopped where the same journey could be made by train in under 2.5 hours.
Arsenal forward Saka signs new long-term contract,/sport/football/65686263,Football,"Bukayo Saka says Arsenal is the ""right place to make the next step"" after signing a new contract with the club until 2027."
Hooked on risk - gambling's grip on elite sport,/sport/65601190,Sport,"Competitive, determined, a belief in their own ability to win; the qualities that make elite sportspeople can lead to an addiction that breaks them."
Guardiola hails Brighton's 'influential' De Zerbi,/sport/football/65687254,Football,Manchester City boss Pep Guardiola hails Brighton manager Roberto De Zerbi as one of the most influential managers in the last 20 years.
The 100 greatest children's books of all time,https://www.bbc.com/culture/article/20230522-the-100-greatest-childrens-books-of-all-time,Culture,BBC Culture polled 177 books experts from 56 countries to find the greatest children's books
What global experts think about the top 20 books,https://www.bbc.com/culture/article/20230522-the-20-greatest-childrens-books-ever-what-the-voters-say,Culture,What the experts who voted in the poll say about their top picks
The dark side of Roald Dahl,https://www.bbc.com/culture/article/20160912-the-dark-side-of-roald-dahl,Culture,Why children around the world adore the author's macabre world
Why do we find gold so mesmerising?,/reel/video/p0f1b3cz/why-do-we-value-gold-so-much-,,
The science behind intermittent fasting and why it's so good for you,/reel/video/p0fp7b0f/what-is-intermittent-fasting-and-why-is-it-good-for-you-,,
Did Stalin eliminate the last Templars in Russia?,/reel/video/p08w5mj1/did-stalin-eliminate-the-last-templars-in-russia-,,
The Dutch solution to stress,https://www.bbc.com/travel/article/20230522-the-dutch-solution-to-busyness-that-captivated-the-world,Travel,The concept has captured the attention of the world
Why NYC is sinking under its own weight,https://www.bbc.com/future/article/20230523-new-yorks-skyscrapers-are-causing-it-to-sink-what-can-be-done-about-it,Future,Coastal cities are subsiding under the mass of buildings and climate change
A fairy tale 'for the age of Marvel movies' ★★★☆☆,https://www.bbc.com/culture/article/20230522-the-little-mermaid-review-a-spectacle-with-an-allure-and-vitality-of-its-own,Culture,The Little Mermaid is a 'spectacle with an allure and vitality of its own'
An iconic New York Jewish food,https://www.bbc.com/travel/article/20230522-simple-homemade-gravlax,World's Table,It became an updated way to enjoy salmon
How embracing AI gets workers ahead,https://www.bbc.com/worklife/article/20230522-ai-optimism-how-embracing-artificial-intelligence-is-getting-workers-ahead,Worklife,Keeping high spirits about AI in the workplace can pay dividends
Who are the fighters infiltrating Russia from Ukraine?,https://www.bbc.com/news/world-europe-65681806,Europe,Russia claims to have routed two groups that crossed the border from Ukraine
Thor and Star Wars actor Ray Stevenson dies at 58,https://www.bbc.com/news/uk-northern-ireland-65677440,UK,The actor from Northern Ireland was reportedly taken to hospital while filming on Italian island...
Where the sound of nature is too quiet,/future/article/20230519-the-sound-recordings-used-to-coax-back-species,,
Lebanon's unexpected solar boom,/future/article/20230517-how-solar-power-is-keeping-lebanons-lights-on,,
The 1968 photo that changed the world,/future/article/20230511-earthrise-the-photo-that-sparked-an-environmental-movement,,
What can art tell us about the story of Britain?,/news/entertainment-arts-65653851,Entertainment & Arts,Tate Britain unveils a complete rehang of the world's greatest collection of British art.
Brazil declares emergency over bird flu cases,/news/world-latin-america-65679328,Latin America & Caribbean,
Indian banks start exchanging withdrawn top currency,/news/world-asia-india-65679657,India,
AI scanner used in hundreds of US schools misses knives,/news/technology-65342798,Technology,
Ivory ban to extend to hippos and killer whales,/news/science-environment-65673951,Science & Environment,
How Ukraine is tackling the mental scars of war,/news/world-europe-65418075,Europe,
Rushdie reveals he is writing again after attack,/news/entertainment-arts-65686590,Entertainment & Arts,
Ray Stevenson's film and TV career in pictures,/news/entertainment-arts-65679323,Entertainment & Arts,
Picnics and blooms: The Chelsea Flower Show in pictures,/news/in-pictures-65669737,In Pictures,
"Showers, shopping and soccer: The best of British press photography",/news/in-pictures-65645239,In Pictures,
"Dancers, divers and film-makers: Africa's top shots",/news/world-africa-65622722,Africa,
Slurping Spaghetti and other food photo contest winners,/news/in-pictures-65549869,In Pictures,
