title,href,tag,summary
Israel passes reform law despite mass protests,/news/world-middle-east-66258416,Middle East,A bill which has caused uproar becomes law as protesters face water cannon outside parliament.
Justice department sues Texas over border barrier,/news/world-us-canada-66296989,US & Canada,
Heatwave to spread east across huge parts of US,/news/world-us-canada-66290589,US & Canada,
Could your swimwear attract sharks?,https://www.bbc.com/future/article/20230720-yum-yum-yellow-are-sharks-attracted-to-bright-colours,Future,
How Carrie and gang are ageing in style,https://www.bbc.com/culture/article/20230721-and-just-like-that-are-these-tvs-ultimate-mid-life-looks,Culture,
Russia accuses Ukraine of Moscow drone attack,/news/world-europe-66286102,Europe,"Moscow's mayor says there were no casualties after ""two non-residential"" buildings were hit in the capital."
Probe over police dog attack on surrendering driver,/news/world-us-canada-66296988,US & Canada,"A video shows the K-9 pulling down the driver, who is black, as he was trying to surrender in Ohio."
Spotify raises subscription price for millions,/news/business-66297120,Business,"For the first time since 2011, Spotify confirms a price hike for about 200m ad-free subscribers."
Al-Hilal make record £259m bid for PSG's Mbappe,/sport/football/66291108,European Football,Saudi Arabian side Al-Hilal are given permission to speak to Kylian Mbappe after making a world record £259m bid for the Paris St-Germain forward.
Former England forward Francis dies aged 69,/sport/football/66287307,Football,"Former England international Trevor Francis, who was Britain's first ever £1m footballer, dies at the age of 69."
England name unchanged squad for final Ashes Test,/sport/cricket/66289785,Cricket,"England name an unchanged squad for the fifth and final Ashes Test, which begins at The Oval on Thursday."
Ary Borges scores hat-trick as Brazil beat Panama,https://www.bbc.com/sport/football/66290687,Women's Football,Ary Borges scores the first hat-trick of the 2023 Fifa Women's World Cup
Germany put six past World Cup debutants Morocco,https://www.bbc.com/sport/football/66288659,Football,Germany begin their Women's World Cup campaign in style
A visual guide to the Women's World Cup,https://www.bbc.com/sport/extra/lrfY3Yfkt8/visual-guide-to-the-womens-world-cup,Football,Key facts about the history of the Women's World Cup - the 2023 tournament is taking place in Australia and New Zealand
Alkaline water: Worth the hype or waste of money?,/reel/video/p0g27l49/is-alkaline-water-good-for-you-,,
Why heatwaves have become the number one 'silent killer',/reel/video/p0g2mddk/why-heatwaves-have-become-the-number-one-silent-killer-,,
The age of the Universe might be drastically wrong,/reel/video/p0g1v4pq/how-old-is-the-universe-,,
The forgotten people of a remote isle,https://www.bbc.com/travel/article/20230723-the-hike-making-australia-a-better-place,Travel,Many people think that the culture doesn't even exist
Why we can't shake presenteeism,https://www.bbc.com/worklife/article/20230718-post-pandemic-presenteeism-overwork-culture,Worklife,"When so much at work has changed, why can't we can't get rid of overwork?"
18 of the best books of the year so far,https://www.bbc.com/culture/article/20230420-12-of-the-best-books-of-the-year-so-far-2023,Culture,From compelling stories of family dynamics to a satire of chaotic 1970s Harlem
Why Barbie is being caked in Moon dust,https://www.bbc.com/future/article/20230721-barbies-surprising-role-in-moon-exploration,Future,The doll has helped scientists tackle the problem of lunar dust
Dozens killed as wildfires sweep across Algeria,https://www.bbc.com/news/world-africa-66292753,Africa,Algeria has been experiencing a record heatwave with temperatures reaching 48C (118F)
Sexual assault on girl in botched Taiwan police sting,https://www.bbc.com/news/world-asia-66287776,Asia,The 13-year-old had been used in an undercover operation to help catch a man she met on a dating app
'Fatigued' Djokovic out of Toronto Masters event,https://www.bbc.com/sport/tennis/66286236,Tennis,Novak Djokovic withdraws from next month's Canadian Open in Toronto because of fatigue
What if we stopped all fishing?,/future/article/20230721-what-would-happen-if-we-stopped-fishing,,
How Texas is heat-proofing its cities,/future/article/20230714-how-texas-is-fighting-back-against-heatwaves,,
The ancient Chinese way to cool homes,/future/article/20230712-how-ancient-skywells-are-keeping-chinese-homes-cool,,
Seven AI companies agree to safeguards in the US,/news/technology-66271429,Technology,White House says it's a 'critical step' towards the responsible development of the technology.
In Pictures: Wildfires in Greece,/news/in-pictures-66289156,In Pictures,
"'Brilliant, kind' broadcaster George Alagiah dies at 67",/news/entertainment-arts-65949435,Entertainment & Arts,
How does the UK economy compare to other countries?,/news/business-66269947,Business,
Greta Thunberg fined over Swedish climate protest,/news/world-europe-66287756,Europe,
Row over abortion paper saw expert panel quit,/news/uk-66249015,UK,
Earth in uncharted waters as climate records tumble,/news/science-environment-66229065,Science & Environment,
See Africa unmasked through its own lens,/news/world-africa-66257772,Africa,
In pictures: A dramatic 24 hours in politics,/news/in-pictures-66268013,In Pictures,
Whistle-blowers and rainbows: Africa's top shots,/news/world-africa-66256175,Africa,
In pictures: Europe's scorching heatwave,/news/in-pictures-66226313,In Pictures,
Hilarious pictures of pets in comedy photographs,/newsround/66210126,Newsround,
