title,href,tag,summary
Zelensky to speak at The Hague after strikes in Ukraine,/news/live/world-europe-65480044,Europe,It comes a day after Russia accused Ukraine of attempting to assassinate Vladimir Putin.
Teen made 'kill list' for Serbia school attack,https://www.bbc.com/news/world-europe-65468404,Europe,
Erdogan rival pledges to restore Turkish democracy,https://www.bbc.com/news/world-europe-65467117,Europe,
What kings wore from Tudor times to now,https://www.bbc.com/culture/article/20230503-what-a-kings-personal-style-reveals,Culture,
The true story of the Kentucky Derby,https://www.bbc.com/travel/article/20230503-the-kentucky-derbys-forgotten-black-past,Travel,
Ros Atkins on... the videos showing 'Kremlin attack',/news/world-europe-65476367,Europe,The BBC’s Analysis Editor looks at the footage circulating on Russian social media.
US approves world's first RSV vaccine,/news/world-us-canada-65477747,US & Canada,Officials say the vaccine against the deadly virus could be rolled out for older adults by August.
New York subway passenger died after chokehold,/news/world-us-canada-65472810,US & Canada,"A medical examiner has ruled the cause of death to be homicide, from ""compression of neck""."
"Premier League news and your views on Haaland, Allardyce",/sport/live/football/65473304,Football,"Manchester City beat West Ham to top table again as Erling Haaland sets new Premier League record, plus Liverpool defeat Fulham and Women's Super League."
Why Bellingham's Real move makes 'perfect sense',/sport/football/65477289,European Football,"England midfielder Jude Bellingham joining Real Madrid would be in keeping with their strategy of buying the world's best young players, says Andy West."
"A tour of a lost world, before football changed forever",https://www.bbc.co.uk/sport/extra/DqkhZA6FP7/around-the-92-in-the-1980s,Sport,"Thirty-five years ago, a father and son set off to tour every Football League ground. They brought back a record of a disappearing era and a lasting relationship."
Your full guide to how Coronation day will unfold,https://www.bbc.com/news/uk-65342840,UK,"Processions, ancient rituals, a fly-past and the crowning moment"
A chicken dish made for the queen,https://www.bbc.com/travel/article/20230430-coronation-chicken-the-story-behind-the-royal-dish,World's Table,The famous dish has been reimagined by a variety of chefs over the years
Charles is King of 15 countries - but for how much longer?,https://www.bbc.com/news/world-65426265,World,BBC correspondents describe the mood in nations where King Charles is still head of state and the chances of replacing the monarchy any time soon
The truth about the Kama Sutra,/reel/video/p0fl4b21/kama-sutra-a-misunderstood-ancient-indian-sanskrit-text,,
Why do French men pee on the street?,/reel/video/p0fg8f6z/why-do-french-men-pee-on-the-street-,,
Is this the real face of Elizabeth I?,/reel/video/p06npby0/is-this-the-real-face-of-elizabeth-i-,,
Do you own too many clothes?,https://www.bbc.com/future/article/20230502-how-to-make-your-wardrobe-sustainable,Future,The 'sufficient' wardrobe
A regal scone made for King Charles III,https://www.bbc.com/travel/article/20230503-marthas-collisons-coronation-crown-scones,Travel,"Shaped into a crown, they're infused with Darjeeling and honey"
Can remote-work gossip backfire?,https://www.bbc.com/worklife/article/20230427-the-perks-and-perils-of-remote-work-gossip,Worklife,Why venting about your boss just became much riskier
The rappers risking the death penalty,https://www.bbc.com/culture/article/20230502-hichkas-the-song-that-became-an-iranian-protest-anthem,Culture,How hip-hop has soundtracked Iran's protest era
Row over Met Gala's Karl Lagerfeld tribute,https://www.bbc.com/news/entertainment-arts-65469466,Entertainment & Arts,Actress Jameela Jamil criticises the A-list event for honouring the controversial designer
The good and bad of ADHD content on TikTok,https://www.bbc.com/news/newsbeat-65457044,Newsbeat,"Content about the condition gets billions of views, but is it driving too many to self-diagnose?"
Is this anti-vaxxer the next Alex Jones?,https://www.bbc.com/news/blogs-trending-65412798,BBC Trending,An anti-vaccine conspiracy film is supercharging the harassment of bereaved people
The revival of a historic Italian fruit,/future/article/20230424-how-agrivoltaics-helped-save-italys-citron-and-lemon-trees,,
The first climate-resilient nation?,/future/article/20230418-how-caribbean-island-dominica-is-fighting-climate-impacts,,
A major positive climate tipping point,/future/article/20230414-climate-change-why-2023-is-a-clean-energy-milestone,,
Carrie Fisher family row eclipses Hollywood honour,/news/entertainment-arts-65480084,Entertainment & Arts,The Star Wars actress's daughter did not invite her siblings to her Hollywood Walk of Fame ceremony.
"Meta putting child users at risk, regulator says",/news/technology-65478062,Technology,
Europe's new weather satellite takes first photos,/news/science-environment-65476909,Science & Environment,
Australia to ban recreational vaping,/news/world-australia-65446352,Australia,
The 17 most eye-catching looks at the Met Gala,/news/entertainment-arts-65413976,Entertainment & Arts,
Covid whistleblower returns home to Wuhan after jail,/news/world-asia-china-65454824,China,
Can Morocco solve Europe’s energy crisis?,https://www.bbc.co.uk/news/business-65415529,Business,
Parasols and prayers: Africa's top shots,/news/world-africa-65409697,Africa,
The photos that chronicle the cost of dying,/news/uk-scotland-65354687,Scotland,
Len Goodman obituary: From the East End to Strictly stardom,/news/entertainment-arts-58929590,Entertainment & Arts,
Penarth: Nofio gyda'r wawr yn y môr // Sea swimming at dawn,/newyddion/65372997,Cylchgrawn,
In pictures: Muslims around the world celebrate Eid,/news/in-pictures-65346964,In Pictures,
