title,href,tag,summary
US joins Germany in sending tanks to Ukraine,/news/world-us-canada-64404928,US & Canada,"Ukraine hails the announcements as a turning point, while Russia says they are a provocation."
"School was warned about boy, 6, with gun - lawyer",https://www.bbc.com/news/world-us-canada-64406295,US,
Director speaks out on misogyny after Oscars snub,https://www.bbc.com/news/entertainment-arts-64396730,Entertainment & Arts,
Another mystery hit from Mr Knives Out ★★★★☆,https://www.bbc.com/culture/article/20230124-poker-face-review-a-deft-columbo-update-for-knives-out-fans,Culture,
"A 3,500-year-old disease that persists",https://www.bbc.com/future/article/20230124-leprosy-the-ancient-disease-scientists-cant-solve,Future,
Millions across US under winter storm watch,/news/world-us-canada-64401720,US & Canada,"Forecasters predict heavy snow in many areas, with a tornado watch in effect in the South."
Eating chicken without killing chicken?,/news/world-us-canada-64381704,US & Canada,A US firm has regulatory approval for lab-grown meat and is aiming to sell it to restaurants soon.
Tyre Nichols autopsy indicates beating - lawyers,/news/world-us-canada-64404827,US & Canada,"The 29-year-old was stopped in Memphis on 7 January for reckless driving, and died three days later."
EFL Cup: Man Utd lead Forest 2-0 in entertaining semi-final,/sport/live/football/64317693,Football,Follow live text and BBC Radio commentary as Nottingham Forest host Manchester United in the EFL Cup semi-final first leg.
Reed is 'not living in reality' - McIlroy on snub,/sport/golf/64399598,Golf,"Rory McIlroy says Patrick Reed is not ""living in reality"" after the American tried to chat in Dubai despite his lawyers serving him a court summons on Christmas Eve."
Watch: McIlroy snubs Reed after court summons,/sport/av/golf/64400605,Golf,"Rory McIlroy says Patrick Reed is not ""living in reality"" after the American tried to chat with him in Dubai despite his lawyers serving the world number one a court summons on Christmas Eve."
The surprising benefits of dancing even if you're not good at it,/reel/video/p0dyj8xw/why-dancing-is-key-to-our-humanity,,
The unexpected origin of Portugal's famous paving tradition,/reel/video/p0dqhjpj/the-surprising-story-of-a-16th-century-rhino-called-ganda,,
Is a vegan diet healthier than eating meat and dairy?,/reel/video/p0b5x2z7/is-a-vegan-diet-healthier-than-eating-meat-and-dairy-,,
The highest pub in Britain,https://www.bbc.com/travel/article/20230125-the-tan-hill-inn-the-highest-pub-in-britain,Travel,It's one of the few places in England where you can see the Northern Lights
Is a four-day workweek truly realistic?,https://www.bbc.com/worklife/article/20230125-how-widespread-could-the-four-day-workweek-really-be,Worklife,The buzz is around shorter workweeks – but are they attainable for all?
Georgia's surprising LGBTQ+ scene,https://www.bbc.com/culture/article/20230124-the-comedian-fighting-prejudice-with-laughter-in-georgia,Culture,The trans comedian breaking boundaries in socially conservative Georgia
Are ski trips coming to an end?,https://www.bbc.com/future/article/20230124-how-climate-change-threatens-to-close-ski-resorts,Future Planet,The ski resorts adapting to a warming world
When insects were as big as birds,https://www.bbc.com/future/article/20230123-why-prehistoric-giant-animals-got-smaller,Future,"In another era, invertebrates ruled the world"
"Britain, Spain, Singapore? Gibraltar mulls its future",https://www.bbc.com/news/world-europe-64377942,Europe,"As talks resume on its future, the British overseas territory fears for its sovereignty and border"
The family tending war graves for 100 years,https://www.bbc.com/news/world-middle-east-64344483,Middle East,The tradition which began during World War One has been passed from father to son
Why Italy's olive trees are dying,/future/article/20230111-the-super-sniffer-dogs-saving-italys-dying-olive-trees,,
How far can vertical farming go?,/future/article/20230106-what-if-all-our-food-was-grown-in-indoor-vertical-farms,,
The batteries made from wood,/future/article/20221215-the-batteries-made-from-wood,,
How to watch 2023's Oscar-nominated films,/news/entertainment-arts-64388101,Entertainment & Arts,The nominations have been revealed - now find out about the leading films and where to see them.
Dentists warn of damage from braces ordered online,/news/uk-58038752,UK,
Twitter sued over antisemitic posts left online,/news/technology-64404590,Technology,
Dante's Inferno and faux taxidermy grace Paris catwalks,/news/in-pictures-64384978,In Pictures,
British shot putter criticises athletics' transgender plans,/sport/athletics/64396740,Athletics,
Justin Bieber sells rights to songs for $200m,/news/entertainment-arts-64394448,Entertainment & Arts,
Microsoft says services have recovered from outage,/news/technology-64397643,Technology,
The people left behind by coal mining's demise,/news/uk-wales-64330180,Wales,
Africa's top shots: Celebrating 2973 and baptising Jesus,/news/world-africa-64325591,Africa,
Aurora hunter treated by coastal lights display,https://www.bbc.co.uk/news/articles/ckdjzlq0eppo,News,
The AI artist reimagining a stylish old age,/news/world-africa-64260739,Africa,
Photos show challenges of 2020s Britain - creator,/news/uk-england-manchester-64190040,Manchester,
