title,href,tag,summary
Taliban to stop Afghans going to Kabul airport,/news/live/world-58279900,World,A Taliban spokesman has said Afghans should not to go to the airport or try to leave the country.
Iran prisons chief apologises over abuse videos,https://www.bbc.com/news/world-middle-east-58315816,Middle East,
"'Never again', vows toddler lost in woods for days",https://www.bbc.com/news/world-europe-58315926,Europe,
The subtle influence of the Moon,https://www.bbc.com/future/article/20210820-the-subtle-influence-of-the-moon-on-earths-weather,Future,
What our private scribbles can reveal,https://www.bbc.com/culture/article/20210823-from-da-vinci-to-churchill-what-our-doodles-can-mean,Culture,
How Afghanistan rattled Asia and emboldened China,/news/world-asia-58312949,Asia,"US VP Kamala Harris tries to reassure Asian allies, as many ask: can they still trust America?"
Credible reports of executions by Taliban - UN,/news/world-asia-58315413,Asia,"Human rights violations against Afghan women and girls have also been reported, the UN says."
Tonnes of dead fish wash up in Spanish lagoon,/news/world-europe-58311105,Europe,"Ecologists say pollution is to blame, as officials consider declaring the Mar Menor a disaster area."
Carabao Cup build-up and transfer latest,/sport/live/football/58313875,Football,"All the Carabao Cup build-up, press conference coverage and the latest on transfers as the deadline gets closer"
Vikings have vaccine talk from expert,/sport/american-football/58315660,American Football,The Minnesota Vikings bring in an infectious disease expert to speak to the players about the Covid-19 vaccine.
"Clark, Kelly & Ferguson in Scotland pool",/sport/football/58317930,Football,"St Johnstone goalkeeper Zander Clark, Motherwell counterpart Liam Kelly, and Aberdeen midfielder Lewis Ferguson are named in the Scotland squad for next month's World Cup qualifiers."
The remote Indian village where giant vegetables grow,/reel/video/p09qlqxj/the-disappearing-village-where-huge-radishes-grow,,
Lessons on wealth from the happiest country in the world,/reel/video/p09fc6tx/the-truth-behind-the-nordic-myth-of-endless-wealth,,
Inside the secluded beach for ultra-Orthodox Jewish women,/reel/video/p09qlpls/inside-the-secluded-beach-for-ultra-orthodox-jewish-women,,
The case for a shorter workweek,https://www.bbc.com/worklife/article/20210819-the-case-for-a-shorter-workweek,Worklife,The arguments for working fewer hours for the same pay
The man preserving endangered colours,https://www.bbc.com/travel/article/20210823-the-man-preserving-endangered-colours,Travel,He's preserving a millennium's worth of wisdom and culture
The most iconic rock anthem of the 80s?,https://www.bbc.com/culture/article/20210820-edge-of-seventeen-an-anthem-that-stuns-each-new-generation,Culture,Why Stevie Nicks' Edge of Seventeen stuns each new generation.
How supermassive black holes got so big,https://www.bbc.com/future/article/20210820-where-did-supermassive-black-holes-come-from,Future,Where the Universe's biggest black holes came from is a mystery
Your guide to Paralympic classification,https://www.bbc.com/sport/disability-sport/57396986,Sport,Everything you need to know about classification at the Paralympic Games
Which filmmaker is the next LongShots star?,https://www.bbc.com/culture/article/20210816-longshots-2021-the-directors-behind-the-shortlisted-films,LongShots,Meet the 16 documentary filmmakers behind the shortlisted films
"Shot, left for dead, and now a pub high-flyer",/news/uk-58266180,UK,Cesar Kimbirima fled Angola after being shot four times and spending five months in a coma
The controversial plan to rewild death,/future/article/20210817-rewilding-death-germanys-plan-to-restore-the-necrobiome,,
The ancient Persian way to keep cool,/future/article/20210810-the-ancient-persian-way-to-keep-cool,,
The vast methane leaks seen from space,/future/article/20210805-the-search-for-the-worlds-largest-methane-sources,,
Tokyo Games: Robot Zen garden inspired by athletes,/news/technology-58268061,Technology,Sportspeople’s movements are interpreted and artistically recreated making ever changing artwork.
Three million watch Love Island winners crowned,/news/entertainment-arts-58306258,Entertainment & Arts,
Europe's extreme rains made more likely by humans,/news/science-environment-58309900,Science & Environment,
Taiwan rolls out homegrown vaccine amid criticism,/news/world-asia-58301573,Asia,
From earrings to tiles – what you can do with plastic waste,/news/stories-58305686,Stories,
Prisoners to plug worker shortage in meat industry,/news/business-58303679,Business,
Woman says R. Kelly pressured her to have abortion,/news/entertainment-arts-58315144,Entertainment & Arts,
Final photos for crime author's prize revealed,/news/uk-england-tyne-58291532,Tyne & Wear,
Search on to find people and places in old photos,/news/uk-england-leeds-58280481,Leeds & West Yorkshire,
"Africa's top shots: Ninjas, wildfires and drums",/news/world-africa-58267380,Africa,
In pictures: Desperate search after Haiti quake,/news/in-pictures-58258287,In Pictures,
Striking image captures Afghan exodus,/news/world-asia-58242733,Asia,
