title,href,tag,summary
Putin pays surprise visit to occupied Mariupol,/news/world-europe-65004610,Europe,"The Russian president toured the Ukrainian city devastated by Russian shelling, the Kremlin says."
Trump says he expects to be arrested on Tuesday,https://www.bbc.com/news/world-us-canada-65000325,US,
UBS in urgent talks to rescue Credit Suisse,https://www.bbc.com/news/business-65004605,Business,
Taliban officials must sack sons given government jobs,https://www.bbc.com/news/world-asia-65005792,Asia,
Premier League: Saka doubles Arsenal lead against Palace,/sport/live/football/64405197,Football,
"Trump prosecution a political move, say Republicans",/news/world-us-canada-65007991,US & Canada,"Members of the former president's party claim prosecutors investigating him are part of the ""radical left""."
Is France's government doomed by the pension crisis?,/news/world-europe-64986741,Europe,No-confidence motions face the Macron government as it tries to force its unpopular changes into law.
"Great to be here, says Lineker as he returns to TV",/news/uk-65003113,UK,Lineker hosts BBC sports coverage for first time after being taken off air in an impartiality row.
FA Cup: Brighton lead League Two Grimsby - watch & follow,/sport/live/football/64866410,Football,"Watch BBC One coverage of Brighton v Grimsby Town, plus follow Sheffield Utd v Blackburn Rovers and Man Utd v Fulham."
'Unacceptable to spoil games with poor red cards',/sport/rugby-union/65006193,Rugby Union,"Matt Dawson says referee Jaco Peyper's decision to send Freddie Steward off in England's defeat by Grand Slam-winning Ireland was ""disgraceful""."
India v Australia - second ODI scorecard,https://www.bbc.co.uk/sport/cricket/scorecard/ECKO56740,Sport,Latest scorecard from the second one-day international between India and Australia in Visakhapatnam.
Shipping's wind power revolution,https://www.bbc.com/future/article/20230310-will-shipping-return-to-its-ancient-roots,Future Planet,The next generation of ships is harnessing the power of the wind
"A 1,077km drive that demands respect",https://www.bbc.com/travel/article/20230315-tanami-track-australias-epic-1077km-road-trip,Travel,It crosses one of the most isolated and arid regions in the world
Why you need more sleep in the winter,https://www.bbc.com/future/article/20230315-how-the-seasons-change-our-sleep,Future,Should we change our bedtime according to the time of year?
"The incredible 2,400-year-old shipwreck frozen in time",/reel/video/p0f9h955/the-ancient-secrets-lurking-beneath-the-black-sea,,
"It only has one table, and it's booked for months",/reel/video/p0f8kjqb/dept-of-culture-a-nigerian-chef-takes-over-new-york-city,,
The man who discovered the 'abyss of time',/reel/video/p0f7smlm/the-man-who-discovered-the-abyss-of-time-,,
Three facts about... recycling,https://www.bbc.com/future/article/20230317-how-recycling-can-help-the-climate-and-other-facts,Future,Should you wash your recycling or not? And the gold in your pocket
Hollywood's most misogynistic cliché,https://www.bbc.com/culture/article/20230315-how-shrinking-perpetuates-hollywoods-most-sexist-clich,Culture,How film and TV are hung up on the 'dead wife' trope
Going phone-free 'sets up for failure',https://www.bbc.com/worklife/article/20230313-is-it-possible-to-digital-detox-anymore,Worklife,Why digital detoxing may be an impossible goal
A cuisine without a country,https://www.bbc.com/travel/article/20230317-shirini-zereshk-palau-sweet-barberry-pilaf,Travel,One cook aims to revive her ancient cuisine one recipe at a time
The New Zealand flood victims too scared to go home,https://www.bbc.com/news/world-asia-64940342,Asia,Cyclone Gabrielle has sparked a nationwide debate about climate change and vulnerable homes
Why Egyptians are being asked to eat chicken feet,https://www.bbc.com/news/world-64951519,World,Rising food prices mean Egyptians are struggling to put food on the table for their families
Extradited to the UK for a 41-year-old pub brawl,https://www.bbc.com/news/uk-64678781,UK,A man who fled the UK after a fight is acquitted after extradition proceedings 41 years later
A better way to make concrete,/future/article/20230309-how-carbon-negative-concrete-can-help-the-climate,,
The clothes you can't recycle,/future/article/20230227-how-to-recycle-your-clothes,,
How longer weekends help the planet,/future/article/20230220-is-a-4-day-workweek-good-for-the-climate,,
Samara Joy brought back old-school jazz. It won her a Grammy,/news/entertainment-arts-64982203,Entertainment & Arts,The 23-year-old unexpectedly beat major pop stars to win Best New Artist. Here's how she did it.
Office perks: Dog hotels and beer taps,https://www.bbc.co.uk/news/business-64914894,Business,
'A village's goodwill saved me from homelessness',/news/science-environment-64940840,Science & Environment,
"Puppeteers, superstars and dinosaurs: Africa's top shots",/news/world-africa-64976952,Africa,
Drug giant becomes latest to cap US insulin prices,/news/world-us-canada-64991714,US & Canada,
How many other Hemsbys are waiting to happen?,/news/uk-england-norfolk-64944384,Norfolk,
Credit Suisse shares hit as investor fears reignite,/news/business-64986520,Business,
The 50 Paddy Irishmen banishing the stereotypes,/news/uk-northern-ireland-64913882,Northern Ireland,
Brian May knighted by King at Buckingham Palace,/news/uk-64960536,UK,
The best fashion looks at the Oscars,/news/entertainment-arts-64935067,Entertainment & Arts,
'I rarely saw people who looked like me',/news/uk-england-merseyside-64881091,Liverpool,
Tributes paid to acclaimed documentary photographer,/news/uk-england-tyne-64918073,Tyne & Wear,
