title,href,tag,summary
Race against time to find missing Titanic sub,/news/live/world-us-canada-65953941,US & Canada,The vessel vanished on Sunday morning after losing communications an hour and 45 minutes into a dive.
What we know so far about the missing Titanic sub,https://www.bbc.com/news/world-us-canada-65934887,US & Canada,
Taiwan reels from kindergarten druggings scandal,https://www.bbc.com/news/world-asia-65947346,Asia,
What did the Vikings eat?,https://www.bbc.com/travel/article/20230619-what-did-the-vikings-eat,World's Table,
Seven cleverly-designed emergency homes,https://www.bbc.com/culture/article/20230619-seven-cleverly-designed-emergency-homes-around-the-world,Culture,
Watch: Inside Titanic sub before it went missing,/news/world-us-canada-65958697,US & Canada,"Filmed in 2022, OceanGate's boss Stockton Rush gave a glimpse into the small vessel that travels to the Titanic wreck."
Uganda school attack: I covered myself in blood to hide,/news/world-africa-65950983,Africa,A student tells the BBC he survived an attack by suspected Islamist rebels by pretending to be dead.
Teenage Anglo-Saxon girl's face revealed,/news/uk-england-cambridgeshire-65919518,Cambridgeshire,"The face of a 16-year-old girl who died more than 1,300 years ago is revealed."
England win but Wales & Northern Ireland lose - Euro 2024 reaction,/sport/live/football/65958619,Football,"Bukayo Saka scores a hat-trick as England put seven past North Macedonia, but Wales and Northern Ireland lose - reaction to last night's Euro 2024 qualifying matches."
Spirit of 2005 fuels prospect of Edgbaston classic,/sport/cricket/65957361,Cricket,"Edgbaston has served up more than its fair share of Ashes classics and the finale of this year's first Test could be another, says chief cricket writer Stephan Shemilt."
'Starboy smile a sign of how times have changed for England',/sport/football/65957771,Football,"Bukayo Saka was the shining light in England's 7-0 Euro 2024 qualifying win over North Macedonia on Monday, but there are other stars in Gareth Southgate's squad who are vying for a starting spot."
How artificial intelligence is helping us talk to animals,/reel/video/p0fw36yv/how-artificial-intelligence-is-helping-us-talk-to-animals,,
This is what Stonehenge really sounded like,/reel/video/p0frkb7n/what-did-stonehenge-sound-like-,,
The poisonous origin of life on Earth,/reel/video/p0fvdy88/the-poisonous-origin-of-life-on-earth,,
Do you have an end-of-history illusion?,https://www.bbc.com/future/article/20230619-how-the-end-of-history-illusion-shapes-your-life-choices,Future,Why we struggle to picture our future selves
A big job-market problem for women,https://www.bbc.com/worklife/article/20230615-why-its-getting-harder-for-some-women-to-report-harassment,Worklife,"""I was especially not prepared to put my neck on the line"""
America's black national anthem,https://www.bbc.com/culture/article/20230619-lift-every-voice-and-sing-the-black-national-anthem-born-from-a-birthday-party,Culture,How Lift Every Voice and Sing changed a nation
The Black farmer who inspired a US park,https://www.bbc.com/travel/article/20230618-sir-lancelot-jones-the-black-farmer-who-inspired-a-us-park,Travel,He lived alone on an island for 94 years and refused to sell it
The homes built from cannabis,https://www.bbc.com/future/article/20230614-the-buildings-constructed-from-cannabis,Future Planet,The rise of hemp architecture
Why is Reddit full of pictures of John Oliver?,https://www.bbc.com/news/technology-65949412,Technology,Some of the biggest subreddits are now only allowing posts featuring the British comedian
Sudan players hope to 'bring joy' to war-torn nation,https://www.bbc.com/sport/africa/65929852,Sports,The team hopes qualification will lift spirits for fans affected by Sudan's civil war
Finland's plan to bury nuclear waste,/future/article/20230613-onkalo-has-finland-found-the-answer-to-spent-nuclear-fuel-waste-by-burying-it,,
Could hosepipe drones tackle wildfires?,/future/article/20230609-can-we-use-firefighting-drones-put-out-wildfires,,
A 'game changer' for tracking species,/future/article/20230606-how-air-pollution-sensors-can-find-wildlife,,
Beauty of insects revealed in photo competition,/news/in-pictures-65876963,In Pictures,The winning images from the Royal Entomological Society Insect Week photographic competition.
To the Manor Born actress Angela Thorne dies,/news/entertainment-arts-65948570,Entertainment & Arts,
Global monkey torture ring exposed by BBC,/news/world-65951188,World,
Why Spotify's big bet on Meghan fell flat,/news/business-65936228,Business,
A daytime nap is good for the brain,/news/health-65950168,Health,
Sudden heat increase in seas around UK and Ireland,/news/science-environment-65948544,Science & Environment,
Airbus experiments with more control for the autopilot,https://www.bbc.co.uk/news/business-65676421,Business,
Dazzling ancient bronze sword found in Germany,/news/world-europe-65936594,Europe,
Burna Boy bling and high flyers: Africa's top shots,/news/world-africa-65919659,Africa,
Man trots globe blending scenes into film locations,/news/uk-england-essex-65786652,Essex,
In pictures: Nottingham attack shakes city to core,/news/uk-65899897,UK,
Surreal skies grip New Yorkers - in pictures,/news/in-pictures-65843841,In Pictures,
