title,href,tag,summary
Mariupol defenders' bodies in Kyiv - families,/news/world-europe-61723282,Europe,The soldiers' families say they were returned as part of a swap with Russia - 160 bodies on each side.
Why I risk my life to provide aid in Ukraine,/news/world-europe-61720402,Europe,
Recount due in bid to oust 'last pro-life Democrat',/news/world-us-canada-61569648,US & Canada,
Pitt says Jolie sought to harm him with vineyard sale,/news/entertainment-arts-61716949,Entertainment & Arts,
Kane's 50th England goal earns draw in Germany,/sport/football/61641920,Football,
Migrant caravan heads to US as key summit begins,/news/world-us-canada-61685118,US & Canada,Thousands of migrants are headed to the US in a caravan timed to coincide with the Summit of the Americas.
Guns 'should be a nonpartisan issue',/news/world-us-canada-61726841,US & Canada,"The actor spoke at the White House to advocate for ""responsible gun ownership""."
Top Gun maker sued over copyright breach,/news/business-61714737,Business,The lawsuit claims the film studio did not have the rights to release Top Gun: Maverick.
"'Putin took everything from us, and we just let him'",/sport/football/61681972,Football,Nadya Karpova is one of very few Russian sportspeople to speak out against the war in Ukraine. She does so almost every day.
Johnson resigns from PGA Tour to play LIV Golf,/sport/golf/61718753,Golf,Two-time major champion Dustin Johnson resigns from the PGA Tour in order to play in the Saudi Arabian-funded LIV Invitational Series.
'I've no idea' - injured Raducanu unsure on Wimbledon,/sport/tennis/61721537,Tennis,"Emma Raducanu says she has ""no idea"" whether she will be fit for Wimbledon after she retired from her Nottingham Open opener against Viktorija Golubic."
The secret planet under the Mediterranean,/reel/video/p0c7d16y/the-mediterranean-s-hidden-wonders,,
The tiny Scottish island still inhabited by Vikings,/reel/video/p0cbfd0z/why-the-vikings-never-left-scotland,,
The surprising reality of what it may feel like to die,/reel/video/p0c59rmr/what-does-dying-really-feel-like-,,
How psychedelics might treat depression,https://www.bbc.com/future/article/20220606-psilocybin-how-psychedelic-drugs-might-treat-depression,Future,We are beginning to understand the medical benefits of hallucinogens
Is this the next smoothie trend?,https://www.bbc.com/travel/article/20220606-belizes-sweet-sustainable-seaweed-shakes,Travel,It's a heritage food with a surprising ingredient
Now or never: The 'sprint' for top jobs,https://www.bbc.com/worklife/article/20220603-why-women-have-to-sprint-into-leadership-positions,Worklife,"If women don't get into senior ranks in the first decade, they often can't"
The 10 best TV shows of 2022 so far,https://www.bbc.com/culture/article/20220606-the-10-best-tv-shows-of-2022-so-far,Culture,From Stranger Things and Severance to Derry Girls and Top Boy
EU sets date for common phone charge cable,https://www.bbc.com/news/technology-61720276,Technology,The EU has provisionally agreed new mobile devices must use the same type of charger
Was newly unearthed Roman road used to trade gold?,https://www.bbc.com/news/uk-wales-61712158,Wales,"Oxford tutor Dr Mark Merrony believes the highway could be Pembrokeshire's real ""golden road"""
Why one of world's poorest countries adopted Bitcoin,https://www.bbc.com/news/world-africa-61565485,Africa,"Some 90% of people in the Central African Republic lack access to the internet, needed to use..."
Predicting famine before it strikes,/future/article/20220525-how-scientists-predict-famine-before-it-hits,,
What if we all stopped flying?,/future/article/20220519-what-if-we-all-stopped-flying,,
The batteries powered by gravity,/future/article/20220511-can-gravity-batteries-solve-our-energy-storage-problems,,
"Jamal Edwards died after taking drugs, mum says",/news/entertainment-arts-61716950,Entertainment & Arts,"His mum Brenda says she was in a ""state of shock"" after finding out how her son died."
"China's plans to go to the Moon, Mars and beyond",/news/world-asia-china-61511546,China,
"Cost to fuel a lorry up £20,000, says haulage boss",/news/business-61716039,Business,
New UK centre will help fight information war,/news/technology-61718097,Technology,
Monkeypox cases outside Africa rise to 780,/news/health-61696974,Health,
Jackdaw gas field given go-ahead by regulators,/news/uk-scotland-scotland-business-61666693,Scotland business,
Crowds watch as Pixie Lott weds at cathedral,/news/uk-england-cambridgeshire-61716984,Cambridgeshire,
Weather Watchers Spring Pic of the Season,https://www.bbc.co.uk/programmes/articles/11FRdLnrnXctMMFVk3ZQKnm/pic-of-the-season-spring-2022,News,
In pictures: Platinum Jubilee pageant,/news/uk-61698428,UK,
In pictures: Stars throw party for Jubilee,/news/entertainment-arts-61693645,Entertainment & Arts,
In pictures: Street parties and celebrations,/news/in-pictures-61689516,In Pictures,
In pictures: Harry and Meghan join royals for service,/news/uk-61681180,UK,
