title,href,tag,summary
China urges calm over 'spy' balloon in US airspace,/news/world-us-canada-64521570,US & Canada,The US condemns China's intrusion as the Pentagon reports a second Chinese balloon over Latin America.
Sixth officer fired after death of Tyre Nichols,/news/world-us-canada-64521857,US & Canada,
Japan PM fires aide over anti-LGBT remarks,/news/world-asia-64521862,Asia,
'I escaped abusive jungle cult - then rescued my son',https://www.bbc.co.uk/news/world-middle-east-63942615,News,
Premier League: Everton on top against leaders Arsenal,/sport/live/football/63889257,Football,
Canadian teen wins $48m lotto jackpot on first try,/news/world-us-canada-64519968,US & Canada,"Sensible Juliette Lamour, 18, immediately turned to a financial planner, or Dad, as she calls him."
Teenager dies in Australian river shark attack,/news/world-australia-64523498,Australia,"The 16-year-old girl was thought to have been swimming in the Swan River, Western Australia Police say."
Elon Musk not guilty of fraud over Tesla tweet,/news/world-us-canada-64520157,US & Canada,The Tesla boss is cleared of fraud charges over a tweet about taking the carmaker back into private ownership.
"Six Nations: Wales v Ireland - watch, listen & follow text",/sport/live/rugby-union/61380837,Rugby Union,Watch live coverage and follow text and radio commentary as Wales host Ireland in the opening game of the 2023 Six Nations.
WSL: Aston Villa lead Brighton after Man City beat Leicester,/sport/live/football/64291106,Football,Follow live text coverage as Leicester City host Manchester City and Aston Villa take on Brighton in the Women's Super League.
"Championship: Leaders Burnley ahead at Norwich, Sheff Utd at Rotherham",/sport/live/football/64447740,Football,"Follow live text commentary from the EFL, with games across the Championship, League One and League Two."
Italy's ancient homes for dodging taxes,https://www.bbc.com/travel/article/20230202-italys-ancient-conical-homes,Travel,They're a Unesco World Heritage site – but many people have never heard of them
The 90s star who became a Gen Z icon,https://www.bbc.com/culture/article/20230201-how-country-pop-superstar-shania-twain-became-a-gen-z-icon,Culture,Why the country-pop superstar is riding higher than ever
Secrets of the lost dinosaur continent,https://www.bbc.com/future/article/20230202-the-weird-dinosaurs-of-americas-lost-continent,Future,Hidden within North America is a continent once ruled by bizarre dinosaurs
The unspeakable barbarity committed against Niger,/reel/video/p0f0pvg8/the-unspeakable-barbarity-committed-against-niger,,
The truth behind your favourite flavours,/reel/video/p0f0cw07/the-truth-behind-your-favourite-flavours,,
The benefits of a 'weekend marriage',/reel/video/p0dztrm5/is-separation-marriage-key-to-a-healthy-relationship-,,
Ireland's tasty new holiday,https://www.bbc.com/travel/article/20230203-recipe-boxty-pancakes-and-bacon-for-st-brigids-day,Travel,It marks the beginning of spring in the ancient Celtic calendar
The unruly ancient rituals for now,https://www.bbc.com/culture/article/20230203-the-unruly-ancient-rituals-still-practised-today,Culture,A revival of interest in chaotic folk customs can tell us a lot about life now
Why women with UTIs are frustrated,https://www.bbc.com/future/article/20230126-why-arent-there-better-treatments-for-cystitis,Future,Women are often dismissed when they report symptoms of urinary tract infections
How worker surveillance is backfiring,https://www.bbc.com/worklife/article/20230127-how-worker-surveillance-is-backfiring-on-employers,Worklife,More companies are monitoring their employees – and it's often doing more harm
Celebrated designer Paco Rabanne dies aged 88,https://www.bbc.com/news/world-europe-64515027,Europe,"Paco Rabanne, best known for his perfumes and fashion designs, dies at his home in France"
Why do celebrities sometimes wear offensive outfits?,https://www.bbc.com/news/newsbeat-64503224,Newsbeat,"Sometimes, outfits can be remembered for the wrong reasons"
Cancer as a young person: 'A blood test saved me',https://www.bbc.com/news/health-64505734,Health,Research suggests many 18-24 year-olds do not know the five major things to look for
Are ski trips coming to an end?,/future/article/20230124-how-climate-change-threatens-to-close-ski-resorts,,
Why Italy's olive trees are dying,/future/article/20230111-the-super-sniffer-dogs-saving-italys-dying-olive-trees,,
How far can vertical farming go?,/future/article/20230106-what-if-all-our-food-was-grown-in-indoor-vertical-farms,,
The history of rock is written on these walls,/news/entertainment-arts-64496004,Entertainment & Arts,"From graffiti to guest books, five venues share the scribblings of rock and pop's biggest stars."
Interpol working out how to police the metaverse,/news/technology-64501726,Technology,
Infected blood inquiry: Five things we have learned,/news/health-64497868,Health,
Africa's top shots: Yellow disguises and bird chasers,/news/world-africa-64497630,Africa,
Fraud claims against Adani group spark political row,/news/world-asia-india-64508129,India,
Bird flu 'spills over' to otters and foxes in UK,/news/science-environment-64474594,Science & Environment,
Canada experiments with decriminalising hard drugs,/news/world-us-canada-64461983,US & Canada,
In pictures: Up Helly Aa,/news/uk-scotland-64464271,Scotland,
Heavy snow disrupts life in India's Himalayan states,/news/world-asia-india-64462193,India,
The defiant low-lying island 70 years after floods,/news/uk-england-essex-64255567,Essex,
Survivors and leaders mark Holocaust Memorial Day,/news/in-pictures-64425194,In Pictures,
'Fen skating is a great metaphor for life',/news/uk-england-cambridgeshire-64399819,Cambridgeshire,
