title,href,tag,summary
Putin critic jailed for 25 years in Russia,/news/world-europe-65297003,Europe,"The former journalist denies the charges against him, which are linked to his anti-war comments."
Explosions and gunfire in Sudan's capital as fighting rages,https://www.bbc.com/news/live/world-africa-65285254,Africa,
Sydney loses ranking as Australia's biggest city,https://www.bbc.com/news/world-australia-65261720,Australia,
Britain's 'cool' new seaside towns,https://www.bbc.com/travel/article/20230416-a-new-life-for-britains-seaside-towns,Travel,
Why 'home co-working' is taking off,https://www.bbc.com/worklife/article/20230413-home-coworking-spaces-with-friends,Worklife,
"Shock and anger in Khartoum, a city not used to war",/news/world-africa-65293537,Africa,Residents say stray bullets and threatened neighbourhood sweeps by armed forces mean nowhere is safe.
Four dead at 16th birthday party shooting in US,/news/world-us-canada-65293737,US & Canada,The shooting at a dance studio in the small town of Dadeville leaves 28 people injured.
'We wish we could go back': Life under Myanmar's military rule,https://www.bbc.co.uk/news/world-asia-65248242,News,The BBC is given a rare chance to see inside Myanmar two years after the coup.
"Football latest, plus stats & opinion on dramatic title race",/sport/live/football/65296596,Football,"Arsenal drop more points, Manchester United win and Chelsea reach Women's FA Cup final - all the reaction to Sunday's football plus build-up to Leeds v Liverpool."
Nervous Arsenal 'still in great position' for title,/sport/football/65294212,Football,After two successive 2-2 draws Arsenal players are showing signs of self-doubt as the Gunners push to become champions for the first time since 2004.
Is Antony starting to live up to £81m price tag?,/sport/football/65295131,Football,Antony scores once and assists another as Manchester United move up to third in the Premier League - so is he finally starting to prove his worth?
The ancient calendars that still rule our lives,/reel/video/p0fgrpd7/why-ancient-calendars-still-rule-the-world,,
Why we're probably living in a Matrix-like simulation,/reel/video/p0ff9hkw/why-your-life-is-probably-a-simulation,,
A simple exercise that gives your brain an unexpected boost,/reel/video/p09v8wyh/a-simple-exercise-that-gives-your-brain-an-unexpected-boost,,
The man hunting down dead celebrities,https://www.bbc.com/culture/article/20230414-scott-covert-artist-mission-to-hunt-down-dead-celebrities,Culture,Why artist Scott Covert has devoted himself to finding famous people's graves
Why some people's pain is ignored,https://www.bbc.com/future/article/20230414-the-search-for-an-objective-measure-of-pain,Future,Biomarkers for pain could help weed bias out of pain treatment
An ancient trick to think more wisely,https://www.bbc.com/worklife/article/20230411-illeism-the-ancient-trick-to-help-you-think-more-wisely,Worklife,Illeism can help you to be more objective and less biased
Costa Rica's beloved rice and beans,https://www.bbc.com/travel/article/20230414-gallo-pinto-costa-rica-rice-and-beans,Travel,"Usually made for breakfast, it can be the ultimate comfort food any time of day"
A simple guide to what's going on in Sudan,https://www.bbc.com/news/world-africa-65284948,Africa,The fighting is a direct result of a vicious power struggle within the military leadership
Musk's SpaceX set to fly biggest rocket ever,https://www.bbc.com/news/science-environment-65294084,Science & Environment,Elon Musk's company is counting down to the debut launch of the most powerful rocket ever built
More people could have hidden bowel condition,https://www.bbc.com/news/health-65276600,Health,"People with microscopic colitis have frequent diarrhoea, stomach pain and fatigue"
A major positive climate tipping point,/future/article/20230414-climate-change-why-2023-is-a-clean-energy-milestone,,
The wool that could capture carbon,/future/article/20230413-can-regenerative-wool-make-fashion-more-sustainable,,
The rich worlds created by avalanches,/future/article/20230405-how-avalanche-management-could-help-wildlife-in-the-alps,,
How artificial intelligence is matching drugs to patients,https://www.bbc.co.uk/news/business-65260592,Business,Health-tech firms around the world are increasingly using AI to help tailor drugs for patients.
Is this the UK's most abused traffic bollard?,/news/uk-65243274,UK,
Landmark locations celebrate Ramadan,/news/uk-england-65266627,England,
Tech worker arrested in Cash App founder's killing,/news/world-us-canada-65257806,US & Canada,
Florida governor signs 6-week abortion ban into law,/news/world-us-canada-65271298,US & Canada,
Ford launches hands-free driving on UK motorways,/news/business-65272929,Business,
Final Eurovision pre-party before Liverpool,/news/entertainment-arts-65278612,Entertainment & Arts,
Homage to a friend wins 2023 Sony World Photography Awards,/news/in-pictures-65208363,In Pictures,
The miniskirt pioneer who defined 60s fashion,/news/in-pictures-65265873,In Pictures,
Jesus wigs and false bananas: Africa's top shots,/news/world-africa-65262841,Africa,
The ship graveyard which has claimed many lives,/news/uk-wales-57853220,Wales,
Green leaves and yawning soldiers: Africa's top shots,/news/world-africa-65200809,Africa,
