title,href,tag,summary
Trump says FBI agents raided his Florida home,/news/world-us-canada-62472908,US & Canada,Monday's search was reportedly connected to an investigation into Mr Trump's handling of official papers.
'Unprecedented in US history': Reaction as Trump home searched,https://www.bbc.com/news/live/world-us-canada-62473806,US,
What we learned from China's Taiwan drills,https://www.bbc.com/news/62460809,Asia,
The new problem for 'overthinkers',https://www.bbc.com/worklife/article/20220803-why-overthinkers-struggle-with-remote-work,Worklife,
Why do we die?,https://www.bbc.com/future/article/20220805-why-do-we-die,Future,
Can Biden capitalise on legislative victories?,/news/world-us-canada-62473654,US & Canada,The paradox of Joe Biden's presidency is his unpopularity despite the success of his legislative agenda.
American great Williams 'evolving away' from tennis,/sport/tennis/62481750,Tennis,"Serena Williams suggests she will be retiring from tennis, saying she is ""evolving away"" from the sport after the US Open."
"She TikToked her divorce, then her ex killed her",/news/world-us-canada-62427084,US & Canada,"Feeling stigmatised after her divorce, Sania Khan found community on TikTok - then her ex returned."
Man Utd end interest in striker Arnautovic,/sport/football/62481317,Football,Manchester United end their interest in former West Ham and Stoke forward Marko Arnautovic.
"Transfer window latest: Rabiot, Fofana, Arnautovic",/sport/live/football/62474741,Football,"Manchester United interested in Juventus midfielder Adrien Rabiot, Chelsea prepare record offer for Wesley Fofana, plus more transfer gossip."
Saving one of England's historic clubs from a wild ride to ruin,/sport/football/62377986,Football,Derby County were founder members of the Football League in 1888. This year they were saved from potential liquidation.
The quest to reveal the origin of this Chinese sinkhole,/reel/video/p0crc7bb/china-s-huge-and-mysterious-xiaozhai-tiankeng-sinkhole,,
The woman behind the world's first long-distance car journey,/reel/video/p0cr5jrj/the-world-s-first-long-distance-car-journey,,
The hidden dangers of vitamin pills,/reel/video/p0c5mwdb/the-truth-about-supplements-and-who-should-be-taking-them,,
Is this the location of El Dorado?,https://www.bbc.com/travel/article/20220808-the-ancient-people-who-reshaped-the-amazon,Travel,"The complexity of these sites is ""mind-blowing"""
The visionaries making a black utopia,https://www.bbc.com/culture/article/20220729-the-visionary-artists-creating-a-black-utopia,Culture,"How ancient myth, magic and sci-fi are inspiring fantastical Afrofuturist art"
How to save trillions of human lives,https://www.bbc.com/future/article/20220805-what-is-longtermism-and-why-does-it-matter,Future,Can we really make choices that will help the many people yet to be born?
Why Gen Z's voices are getting louder,https://www.bbc.com/worklife/article/20220803-gen-z-how-young-people-are-changing-activism,Worklife,"Why Gen Z activists are angry, tech-savvy – and increasingly influential"
Country pop to black spandex - the life of Olivia Newton-John,https://www.bbc.com/news/entertainment-arts-40105353,Entertainment & Arts,The singer found enduring fame in the film Grease
The Taliban sniper now working behind a desk,https://www.bbc.com/news/world-south-asia-62467621,South Asia,"A year after the Taliban took over Afghanistan, the BBC returns to see how people's lives have..."
'I'm using OnlyFans as a second job to pay bills',https://www.bbc.com/news/newsbeat-62377737,Newsbeat,A campaign group says more young people are joining the site because of the rising cost of living
Scotland's most misunderstood landscape,/future/article/20220802-climate-change-the-promise-and-danger-of-scotlands-peat,,
How religion is saving species in India,/future/article/20220726-how-religious-worship-is-boosting-conservation-in-india,,
How to stop storms killing women,/future/article/20220719-how-bangladesh-system-fights-cyclones-climate-disasters,,
Are we falling in love with robots?,https://www.bbc.co.uk/news/business-62007675,Business,"Far from being scary, people who actually live with robots are finding them endearing."
US doctor warns of many undiagnosed polio cases,/news/health-62469534,Health,
Motown hitmaker Lamont Dozier dies aged 81,/news/entertainment-arts-62474956,Entertainment & Arts,
US climate win masks scale of warming challenge,/news/science-environment-62464546,Science & Environment,
PM rules out immediate cost-of-living action,/news/uk-politics-62467987,UK Politics,
North Korea claims to have recovered from Covid,/news/world-asia-62435809,Asia,
Causes of deadly dry-lightning wildfires revealed,/news/science-environment-62406676,Science & Environment,
The bull that has stolen Brummie hearts,/news/uk-england-birmingham-62469114,Birmingham & Black Country,
Northern Lights create summer coastal showcase,/news/uk-england-norfolk-62462822,Norfolk,
Butterfly image wins World Sports Photography Awards,/news/in-pictures-62398456,In Pictures,
In pictures: England's bare lawns and parched parks,/news/uk-62432844,UK,
Africa's top shots: Discus diva and pink ladies,/news/world-africa-62420179,Africa,
