title,href,tag,summary
West’s 'indecision' is killing our people - Ukraine,/news/world-europe-64355839,Europe,"Zelensky adviser tells West to ""think faster"" as pressure grows on countries to send tanks to Ukraine."
California celebrates first official Lunar New Year,https://www.bbc.com/news/world-us-canada-64352318,US,
Japan was the future but it's stuck in the past,https://www.bbc.com/news/world-asia-63830490,Asia,
Man helped pay strangers' prescriptions for years,https://www.bbc.com/news/world-us-canada-64354823,US,
Mudryk on in second half to make Chelsea debut,/sport/live/football/63881992,Football,
Uphill battle looms for New Zealand's next PM,/news/world-asia-64355972,Asia,"The Labour party's popularity has slumped, but Jacinda Ardern is still a hard act to follow."
Thousands gather for first post-Roe March for Life,/news/world-us-canada-64355407,US & Canada,The crowd in the US capital celebrated the Supreme Court's decision to overturn Roe v Wade last year.
US to designate Russia's Wagner as a criminal group,/news/world-us-canada-64353688,US & Canada,The Wagner Group is believed to be receiving shipments of missiles and rockets from North Korea.
Watch: Celtic rout Morton in first of 10 Scottish Cup fourth-round ties,/sport/live/football/64285433,Football,"Watch live BBC One Scotland coverage, listen to Sportsound and follow text updates as nine Scottish Cup fourth-round ties follow Celtic's win over Morton."
EFL: Coventry 2-4 Norwich - Dowell extends Canaries' lead,/sport/live/football/64103135,Football,"Follow live text commentary and score updates across the Championship, League One and League Two starting with Coventry City v Norwich City in the Championship."
Harlequins lead Sharks in vital Heineken Cup match - radio & text,/sport/live/rugby-union/64098354,Rugby Union,Live radio and text commentary as Harlequins face Cell C Sharks with a place in the Heineken Cup last 16 at stake.
The 90s cop show that changed TV,https://www.bbc.com/culture/article/20230119-why-cop-show-homicide-life-on-the-street-was-revolutionary,Culture,How 1990s series Homicide: Life on the Street paved the way for The Wire
Asia's audacious British-built road,https://www.bbc.com/travel/article/20230119-the-hamilton-road-a-highway-to-a-kurdish-paradise,Travel,It's a stunning feat of engineering that nearly didn't happen
Why middle managers are often cast as villains,https://www.bbc.com/worklife/article/20230118-why-middle-managers-are-often-cast-as-villains,Worklife,Middle management is largely reviled. Have we got it all wrong?
The seven loves of Princess Anne,/reel/video/p0dx7bdf/the-seven-loves-of-princess-anne,,
The extraordinary phenomenon that causes a 'skin orgasm',/reel/video/p0dgrs1l/frisson-why-music-can-give-you-chills-or-goosebumps,,
Argentina's dark history with 'death flights',/reel/video/p0dx0fvm/the-aeroplane-as-an-artefact-of-death,,
The giant donkeys of ancient Rome,https://www.bbc.com/future/article/20230116-how-donkeys-changed-the-course-of-human-history,Future,Beasts of burden played a crucial role in the rise and fall of empires
A remedy for low motivation and passion,https://www.bbc.com/worklife/article/20230113-the-mindset-to-re-kindle-lost-passion,Worklife,The five strategies to re-kindle your drive and satisfaction
The masterpiece that changed history,https://www.bbc.com/culture/article/20230118-matisses-the-dance-the-masterpiece-that-changed-history,Culture,How a challenging artwork transformed Matisse
A road trip to Norway's best view,https://www.bbc.com/travel/article/20230115-a-road-trip-to-norways-best-view,Travel,"It was once one of the most difficult, most beautiful places to reach in Norway"
What weapons are being supplied to Ukraine?,https://www.bbc.com/news/world-europe-62002218,Europe,"Military equipment is being sent to support Ukraine, but President Zelensky says more is needed to..."
Crab deaths possibly caused by new disease - report,https://www.bbc.com/news/uk-england-tees-64346633,Science,The report from 12 independent experts found toxic chemicals and dredging were very unlikely causes
Why Shah Rukh Khan's comeback film is a big deal,https://www.bbc.com/news/world-asia-india-64245736,India,The Bollywood superstar returns in James Bond-like spy-thriller Pathaan after a four-year hiatus
How far can vertical farming go?,/future/article/20230106-what-if-all-our-food-was-grown-in-indoor-vertical-farms,,
The batteries made from wood,/future/article/20221215-the-batteries-made-from-wood,,
An answer to India's flower waste,/future/article/20221208-fleather-the-vegan-leather-made-of-indias-flower-waste,,
Crypto lender Genesis files for bankruptcy,/news/technology-64343377,Technology,The cryptocurrency lender’s collapse is the latest blow to the sector.
Mission to Jupiter's icy moons ready for lift-off,/news/science-environment-64336398,Science & Environment,
Dentists warn of damage from braces ordered online,/news/uk-58038752,UK,
Måneskin show the 'dark side of fame' on new album,/news/entertainment-arts-64330158,Entertainment & Arts,
Tech Tent: Game over for Google Stadia,https://www.bbc.co.uk/programmes/w3ct4kj1,Technology,
Glass bottles excluded from deposit return plans,/news/science-environment-64346991,Science & Environment,
Covid: Half a million missed out on heart drugs,/news/health-64330670,Health,
"Messi, a protest and an eagle: Photos of the week",/news/in-pictures-64345503,In Pictures,
Africa's top shots: Celebrating 2973 and baptising Jesus,/news/world-africa-64325591,Africa,
Aurora hunter treated by coastal lights display,https://www.bbc.co.uk/news/articles/ckdjzlq0eppo,News,
The AI artist reimagining a stylish old age,/news/world-africa-64260739,Africa,
Photos show challenges of 2020s Britain - creator,/news/uk-england-manchester-64190040,Manchester,
