title,href,tag,summary
Queen beams on balcony as Jubilee festivities begin,/news/live/uk-61516564,UK,Four generations of royals appear at palace during RAF flypast as huge crowds line the Mall in central London.
Depp wins defamation case against Heard,/news/world-us-canada-61668780,US & Canada,
Turkey changes its name in rebranding bid,/news/world-europe-61671913,Europe,
"Anderson picks up fourth to reduce NZ to 86-8 - clips, radio & text",/sport/live/cricket/58516467,Cricket,
How a hybrid tree conquered the world,https://www.bbc.com/future/article/20220601-are-city-forests-disappearing,Future,
Four killed in Oklahoma hospital shooting,/news/world-us-canada-61669873,US & Canada,Police say the suspected gunman has also died following the attack in Tulsa.
Russia controls a fifth of Ukraine - Zelensky,/news/live/world-europe-61656289,Europe,"Ukraine's president says 20% of the country's territory is in Russian hands, with millions forced to flee."
Texas school shooting victim's parents mourn 'best friend',/news/world-us-canada-61669234,US & Canada,The parents of Alithia Ramirez say they want the world to remember their daughter through her art.
French Open semi-finals: Swiatek v Kasatkina - radio & text,/sport/live/tennis/59071646,Tennis,Follow live text and radio commentary from the women's semi-finals at the 2022 French Open.
England spinner Leach out of Test with concussion,/sport/cricket/61673902,Cricket,England spinner Jack Leach is withdrawn from the first Test against New Zealand at Lord's after suffering symptoms of concussion.
Five South African sides to play in Europe,/sport/rugby-union/61672195,Rugby Union,"Five South African club sides will play in European competition next season, organisers announce."
An unspoken transition has begun,https://www.bbc.com/news/uk-61645993,UK,"This Jubilee will be different, with the Queen largely unseen and an unspoken transition has begun"
70 years of the Queen in 70 seconds,https://www.bbc.com/news/uk-61660128,UK,A quick look back at the Queen's 70 years on the throne and her past jubilee speeches
What's the secret to playing the Queen?,https://www.bbc.co.uk/programmes/m0017yv1,Sounds,The actresses who took on the role of the world's most recognised woman explain how they pulled it off
Why death could be similar to a powerful hallucinogenic,/reel/video/p0c59rmr/what-does-dying-really-feel-like-,,
The scientists learning to read minds,/reel/video/p0c9j6wm/have-scientists-discovered-how-to-read-our-thoughts-,,
"The 3,000-year-old martial art that terrified the British",/reel/video/p0c7trtc/kalaripayattu-india-s-martial-art-and-the-world-s-oldest,,
The hidden hurdles of non-binary dating,https://www.bbc.com/worklife/article/20220601-the-invisible-obstacles-of-non-binary-dating,Worklife,"When a person doesn't identify as a man or woman, dating can get complicated"
Is this the next big food destination?,https://www.bbc.com/travel/article/20220601-meza-malonga-the-afro-fusion-food-making-waves,Travel,It's transcending global misconceptions about cuisine
How the Queen became a style icon,https://www.bbc.com/culture/article/20220530-how-the-queen-became-a-style-icon,Culture,Why Her Majesty's evolving dress sense is a masterclass in royal image making
Is a vegan diet safe for children?,https://www.bbc.com/future/article/20220525-is-a-vegan-diet-healthy-for-kids,Future,India offers surprising lessons on veganism
Why Johnny Depp lost in the UK but won in the US,https://www.bbc.com/news/world-us-canada-61673676,US,Experts say key factors included having a jury trial and his lawyers using a specific legal tactic
Kate Bush running up charts due to Stranger Things,https://www.bbc.com/news/entertainment-arts-61658062,Entertainment & Arts,The UK singer has been trending online after featuring in the new latest series of the Netflix drama
Bronze Age axe head mould declared treasure,https://www.bbc.com/news/uk-wales-61663012,Wales,But the metal detectorist who found the artefact disputes the treasure classification
Predicting famine before it strikes,/future/article/20220525-how-scientists-predict-famine-before-it-hits,,
What if we all stopped flying?,/future/article/20220519-what-if-we-all-stopped-flying,,
The batteries powered by gravity,/future/article/20220511-can-gravity-batteries-solve-our-energy-storage-problems,,
Three questions from the Depp-Heard trial answered,/news/world-us-canada-61668781,US & Canada,Can Amber Heard appeal? How much are she and Depp worth? What are punitive and compensatory damages?
Jackdaw gas field given go-ahead by regulators,/news/uk-scotland-scotland-business-61666693,Scotland business,
Tui customers angry over handling of travel misery,/news/business-61657590,Business,
Supreme Court blocks Texas 'de-platforming' law,/news/world-us-canada-61654959,US & Canada,
Shanghai eases lockdown after two months,/news/world-asia-china-61647687,China,
UK access to EU research programme 'near precipice',/news/uk-politics-61644662,UK Politics,
Jubilee honours for Damian Lewis and Clare Balding,/news/uk-61644729,UK,
"Celebs, sandstorms and striking photos this week",/news/in-pictures-61607954,In Pictures,
Fangs a lot! 'Vampire' gathering smashes record,/news/uk-england-york-north-yorkshire-61597097,York & North Yorkshire,
Africa's top shots: Beaded beekeepers and salt mounds,/news/world-africa-61591198,Africa,
Your pictures of Scotland,/news/uk-scotland-61556530,Scotland,
City of art: From red swimmers to floating teapots,/news/world-africa-61549269,Africa,
