title,href,tag,summary
Civilians evacuated from devastated Ukrainian towns,/news/live/world-europe-60657155,Europe,"People are able to flee Sumy and Irpin, but another attempt to get people out of Mariupol fails."
Are arms shipments to Ukraine making a difference?,https://www.bbc.com/news/world-60655349,World,
Chernobyl workers' ordeal under Russian guard,https://www.bbc.com/news/world-europe-60638949,Europe,
The hidden menace in your kitchen,https://www.bbc.com/future/article/20220228-the-hidden-dangers-lurking-in-your-kitchen,Future,
The woman written out of art history,https://www.bbc.com/culture/article/20220307-janet-sobel-the-woman-written-out-of-history,Culture,
Russia says it may cut gas supplies if oil blocked,/news/business-60656673,Business,A top official says Russia may close its gas lines to Germany if the West halts oil imports.
US poised to ban Russian oil imports,/news/world-us-canada-60666251,US & Canada,"The announcement, expected later today, comes despite fears of ""pain at the pump""."
Revolutionary transplant success for baby Easton,/news/health-60648869,Health,"Doctors hope the pioneering procedure, believed to be a world first, marks a new chapter for transplant surgery."
Root bowled as dismal England slip to 27-3 against West Indies,/sport/live/cricket/56549360,Cricket,"Follow live text commentary from the opening day of the first Test between West Indies and England at Sir Vivian Richards Stadium, Antigua."
Healy helps Australia beat Pakistan,/sport/cricket/60658487,Cricket,Alyssa Healy helps Australia secure a comfortable seven-wicket win against Pakistan at the Women's World Cup.
GB lose to Sweden in wheelchair curling,/sport/winter-sports/60659645,Winter Sports,Great Britain's Winter Paralympics wheelchair curling campaign suffers a blow as the side loses 6-4 to Sweden.
Why the Dutch do something no Spaniard dares to do,/reel/video/p0brp3k4/why-can-t-spaniards-get-rid-of-their-blinds-,,
How wild tomatoes put commercial tomatoes to shame,/reel/video/p0bkptqw/why-we-should-treat-food-like-medicine,,
The deadly toxin found in the world's oldest mummies,/reel/video/p0br366s/life-beyond-death-in-the-driest-place-on-earth,,
The surge in misleading climate adverts,https://www.bbc.com/future/article/20220302-the-adverts-that-were-banned-for-misleading-climate-claims,Future,Companies are facing mounting scrutiny for their green claims
The world's rarest cookbooks?,https://www.bbc.com/travel/article/20220307-romes-new-museum-dedicated-to-cooking,Travel,Some of them forever changed how we eat
Turning Red: 'Life-affirming' new Pixar,https://www.bbc.com/culture/article/20220307-turning-red-review-hilarious-life-affirming-new-pixar,Culture,Five stars for a 'hilarious' and 'straight from the heart' animation
Paid to go back to the office?,https://www.bbc.com/worklife/article/20220307-should-in-office-workers-be-paid-more,Worklife,The firms offering financial incentives to staff who return to the office
'Counting bodies is the best place to start',https://www.bbc.com/news/world-60653099,World,"Many countries do not record femicide, so activists are doing it themselves"
Ed Sheeran sings Nina Simone during copyright case,https://www.bbc.com/news/entertainment-arts-60661895,Entertainment & Arts,The star serenades London's High Court in an attempt to prove he didn't copy his hit Shape of You
The women groped and laughed at in the street,https://www.bbc.com/news/uk-60523422,UK,A survey for the BBC suggests 43% of women have experienced unwelcome touching in public
The puzzle of Mexico's ageing oaks,/future/article/20220222-the-mystery-of-mexicos-vanishing-stream-oaks,,
The animal 'sixth sense' for disaster,/future/article/20220211-the-animals-that-predict-disasters,,
The country embracing life on water,/future/article/20220202-floating-homes-the-benefits-of-living-on-water,,
UK band make chart history to reach US number one,/news/entertainment-arts-60660186,Entertainment & Arts,"The Oxford group's hit Heat Waves finally reaches number one after 59 weeks, the longest ever..."
Crypto platform blocks many Russia-linked wallets,/news/technology-60661763,Technology,
How Covid chaos has spurred India's health services,https://www.bbc.co.uk/news/business-60506228,Business,
Amazon near environmental tipping point - study,/news/science-environment-60650415,Science & Environment,
Covid vaccines not linked to deaths - US study,/news/health-60653946,Health,
Another life-saving Covid drug identified,/news/health-60601750,Health,
Abandoned rocket 'hits the Moon' - scientists,/news/science-environment-60596449,Science & Environment,
Street preachers and their loud speakers,/news/world-africa-60620901,Africa,
Weather Watchers Winter Pic of the Season,https://www.bbc.co.uk/programmes/articles/5VwvcJlBcnxNSG9kgSVmnwW/pic-of-the-season-winter-2021-22,News,
In pictures: Fleeing under Russian shelling,/news/in-pictures-60648172,In Pictures,
In pictures: Russia intensifies attacks on Ukraine,/news/in-pictures-60601185,In Pictures,
"Africa's top shots: Bikes, blocks and borders",/news/world-africa-60599941,Africa,
