title,href,tag,summary
US warns China against support for Russia,/news/live/world-europe-60717902,Europe,US officials have claimed Russia had already asked China for military assistance following the invasion of Ukraine.
Secret paper highlights corrupt Abramovich deals,/news/world-europe-60736185,Europe,
British Fox News journalist wounded in Ukraine,/news/world-us-canada-60741229,US & Canada,
US warns China against helping Russia in Ukraine,/news/world-asia-china-60732486,China,
Have we misunderstood The Godfather?,https://www.bbc.com/culture/article/20220311-the-godfather-have-we-misunderstood-americas-greatest-film,Culture,
Tom Brady 'un-retires' and disappoints unlucky fan,/news/world-us-canada-60741228,US & Canada,"He announced his return only hours after a fan did something that might just have cost him $500,000."
Hamilton plans to change name,/sport/formula1/60738120,Formula 1,Seven-time world champion Lewis Hamilton says he will change his name to incorporate his mother's surname.
Masked gunman shooting homeless while they sleep,/news/world-us-canada-60739098,US & Canada,"Five have been shot in nine days in New York and Washington - all with the same ""modus operandi""."
Players Championship final round: Leader Smith finds water on final hole - radio & text,/sport/live/golf/60738726,Golf,Follow live text updates and BBC Radio 5 Live Sports Extra commentary of the storm-hit Players Championship at TPC Sawgrass in Florida.
Premier League: Crystal Palace 0-0 Man City - Guardiola's side drop two points - radio & text,/sport/live/football/60147192,Football,Follow live radio commentary and text updates as league leaders Manchester City travel to Crystal Palace in the Premier League.
Palace hold wasteful Man City in draw,/sport/football/60642772,Football,Manchester City miss their chance to go six points clear at the top of the Premier League as they are held by Crystal Palace.
The tasty plan to trap damaging carbon underground,/reel/video/p0bkp0zx/the-foods-that-can-turn-back-the-climate-clock,,
How modern life is making men infertile,/reel/video/p09k7qw5/how-modern-life-is-making-men-infertile,,
Have researchers really found the Holy Grail?,/reel/video/p0bt6xl5/is-this-the-home-of-the-holy-grail-,,
The Nordic way to fight bullying,https://www.bbc.com/future/article/20220307-the-best-way-to-stop-bullying,Future,Bullied at school? This strategy can help
The Antarctic ghost town left in ruins,https://www.bbc.com/travel/article/20220313-antarcticas-volatile-deception-island,Travel,Nothing on Deception Island is quite what it seems
The unstoppable rise of 'ghosting',https://www.bbc.com/worklife/article/20220311-why-workers-and-employers-are-ghosting-each-other,Worklife,Workers and recruiters alike are going radio silent. What's going on?
Is Buffy tainted forever?,https://www.bbc.com/culture/article/20220310-buffy-the-vampire-slayer-at-25-how-tainted-is-it,Culture,"As Buffy the Vampire Slayer turns 25, how the show's reputation has been rocked"
"44,000 sign up to UK's refugee site in five hours",https://www.bbc.com/news/uk-60741942,UK,Those wanting to host an individual or family from Ukraine can now register their interest online
Food boss says prices could rise by up to 15%,https://www.bbc.com/news/business-60734384,Business,The boss of food firm 2 Sisters warns prices will jump as a result of the war in Ukraine
Tips on how to spot Ukraine fakes,https://www.bbc.com/news/blogs-trending-60654288,Trending,Ways to slow the spread of bad information and false posts from the war
The homes powered by a kite,/future/article/20220309-the-kites-flying-to-harness-the-worlds-strongest-winds,,
Hong Kong's answer to landslides,/future/article/20220225-how-hong-kong-protects-people-from-its-deadly-landslides,,
The puzzle of Mexico's ageing oaks,/future/article/20220222-the-mystery-of-mexicos-vanishing-stream-oaks,,
Songwriter says he 'feels robbed' by Ed Sheeran,/news/entertainment-arts-60737066,Entertainment & Arts,"Sami Chokri says he was ""belittled"" by Ed Sheeran after noticing similarities between their songs."
Ukraine offered tool to search billions of faces,/news/technology-60738204,Technology,
Energy boss: US gas can replace Russian supplies,/news/business-60729898,Business,
Can the energy crisis help the climate?,/news/uk-politics-60683929,UK Politics,
Ukrainian children flown to UK for cancer treatment,/news/uk-60731806,UK,
Global Covid deaths probably three times higher,/news/health-60690251,Health,
Amazon near environmental tipping point - study,/news/science-environment-60650415,Science & Environment,
Powerful aurora lights up sky above Scotland,/news/uk-scotland-highlands-islands-60736323,Highlands & Islands,
Exhibition to showcase scientific garden's beauty,/news/uk-england-cambridgeshire-60660476,Cambridgeshire,
"In pictures: War, suffering and defiance in Ukraine",/news/world-europe-60720169,Europe,
Africa's top shots: Girl boxers and whistling women,/news/world-africa-60692544,Africa,
Rediscovered photos of 1970s street life go on show,/news/uk-england-manchester-60694448,Manchester,
