title,href,tag,summary
Music legend Tina Turner dies at 83,/news/65669653,Entertainment & Arts,Her unmistakable voice on hits like The Best and What's Love Got to Do With It made her a superstar.
Tributes as Queen of Rock 'n' Roll Tina Turner dies at 83,/news/live/entertainment-arts-65700718,Entertainment & Arts,
Tina Turner's 10 best songs and the stories behind them,/news/entertainment-arts-65672639,Entertainment & Arts,
Why the city that never sleeps is slowly sinking,https://www.bbc.com/future/article/20230523-new-yorks-skyscrapers-are-causing-it-to-sink-what-can-be-done-about-it,Future,
The Chinese BBQ luring millions,https://www.bbc.com/travel/article/20230523-the-chinese-bbq-luring-millions,World's Table,
Ron DeSantis launches 2024 White House bid,/news/live/world-us-canada-65676382,US & Canada,"The Florida governor announces his campaign, challenging Donald Trump to be the Republican nominee."
Canada's household debt is now highest in the G7,/news/world-us-canada-65688460,US & Canada,"Household debt also exceeds Canada's entire GDP, housing agency data reveals."
US park kills bison calf after visitor touches it,/news/world-us-canada-65688462,US & Canada,"Yellowstone says the bison calf was rejected by its herd after it was ""disturbed"" by a park guest."
Premier League: Brighton & Man City level in entertaining clash,/sport/live/football/65448499,Football,Follow live text coverage and radio commentary as Brighton host Premier League champions Manchester City.
Scottish Premiership: Dundee Utd given slimmest lifeline after County held,/sport/live/football/65673868,Football,Listen to Open all Mics on Sportsound and follow live text updates as all 12 teams play their penultimate Scottish Premiership matches.
Van Nistelrooy leaves PSV with immediate effect,/sport/football/65696755,European Football,"PSV Eindhoven head coach Ruud van Nistelrooy leaves before the final last of the season over ""a lack of support within the club"", a PSV statement says."
The 100 greatest children's books - the list in full,https://www.bbc.com/culture/article/20230522-the-100-greatest-childrens-books-of-all-time,Culture,BBC Culture polled 177 books experts from 56 countries to find the greatest children's books
What the experts say about the top 20 books,https://www.bbc.com/culture/article/20230522-the-20-greatest-childrens-books-ever-what-the-voters-say,Culture,What the experts who voted in the poll say about their top picks
The best children's books of the 21st Century,https://www.bbc.com/culture/article/20230521-the-21st-centurys-greatest-childrens-books,Culture,What today's best books reveal about the future
The secret tunnel that saved a besieged city,/reel/video/p0fq0wgn/the-secret-tunnel-that-saved-a-besieged-city,,
Why do we find gold so mesmerising?,/reel/video/p0f1b3cz/why-do-we-value-gold-so-much-,,
The science behind intermittent fasting and why it's so good for you,/reel/video/p0fp7b0f/what-is-intermittent-fasting-and-why-is-it-good-for-you-,,
How embracing AI gets workers ahead,https://www.bbc.com/worklife/article/20230522-ai-optimism-how-embracing-artificial-intelligence-is-getting-workers-ahead,Worklife,Keeping high spirits about AI in the workplace can pay dividends
The 'flawed' skill that shaped history,https://www.bbc.com/future/article/20230518-foresight-the-mental-talent-that-shaped-the-world,Future,Why the imperfect evolution of foresight changed the world
The Dutch solution to stress,https://www.bbc.com/travel/article/20230522-the-dutch-solution-to-busyness-that-captivated-the-world,Travel,The concept has captured the attention of the world
A fairy tale 'for the age of Marvel movies' ★★★☆☆,https://www.bbc.com/culture/article/20230522-the-little-mermaid-review-a-spectacle-with-an-allure-and-vitality-of-its-own,Culture,The Little Mermaid is a 'spectacle with an allure and vitality of its own'
Miami school limits access to Amanda Gorman poem,https://www.bbc.com/news/world-us-canada-65678970,US,A Florida school says the poem The Hill We Climb was moved to the middle school library section
Who is Florida's first lady Casey DeSantis?,https://www.bbc.com/news/world-us-canada-63084196,US,The 42-year-old is expected to play a major role in her husband's campaign for the White House
Target removes some LGBTQ products after threats,https://www.bbc.com/news/world-us-canada-65692233,US,"The company says the move is to protect its employees amid ""confrontational behaviour"""
Where the sound of nature is too quiet,/future/article/20230519-the-sound-recordings-used-to-coax-back-species,,
Lebanon's unexpected solar boom,/future/article/20230517-how-solar-power-is-keeping-lebanons-lights-on,,
The 1968 photo that changed the world,/future/article/20230511-earthrise-the-photo-that-sparked-an-environmental-movement,,
Obituary: Incredible journey from abuse to music superstardom,/news/entertainment-arts-29036876,Entertainment & Arts,Tina Turner was a legendary singer who survived her first husband's horrific abuse and became a...
Brain implants help paralysed man to walk again,/news/science-environment-65689580,Science & Environment,
Branson’s rocket dream ends after mission failure,/news/business-65692302,Business,
Apple strikes major US-made chip deal,/news/business-65692276,Business,
Court dismisses fast-growing chickens welfare case,/news/science-environment-65691321,Science & Environment,
High lead and nickel levels found in illegal vapes,/news/health-65614078,Health,
Tina Turner: A life in pictures,/news/entertainment-arts-65669988,Entertainment & Arts,
Ray Stevenson's film and TV career in pictures,/news/entertainment-arts-65679323,Entertainment & Arts,
Picnics and blooms: The Chelsea Flower Show in pictures,/news/in-pictures-65669737,In Pictures,
"Showers, shopping and soccer: The best of British press photography",/news/in-pictures-65645239,In Pictures,
"Dancers, divers and film-makers: Africa's top shots",/news/world-africa-65622722,Africa,
Slurping Spaghetti and other food photo contest winners,/news/in-pictures-65549869,In Pictures,
