title,href,tag,summary
Ukraine claims new push in Russian-held region,/news/world-europe-62712299,Europe,The reported advance is part of a long-planned offensive by Kyiv to retake the southern Kherson region.
Nasa calls off new Moon rocket launch,https://www.bbc.com/news/science-environment-62715616,Science & Environment,
'World's loneliest man' and last of his tribe dies,https://www.bbc.com/news/world-latin-america-62712318,Latin America & Caribbean,
'There’s more to life than achieving a KPI',https://www.bbc.com/worklife/article/20220825-why-quiet-quitting-is-nothing-new,Worklife,
Britain's disputed 'in between' isles,https://www.bbc.com/travel/article/20220828-the-british-islands-that-disappear-every-day,Travel,
Dutch commando dies after shooting outside US hotel,/news/world-us-canada-62712298,US & Canada,The special forces soldier was one of three Dutch commandos wounded in an attack early on Saturday.
One-third of Pakistan is under water - minister,/news/world-europe-62712301,Asia,"More than 1,130 have died in devastating floods triggered by the heaviest monsoon rains in a decade."
Dominant Iraqi political leader quits,/news/world-middle-east-62713026,Middle East,Supporters of Moqtada al-Sadr storm the presidential palace after he pulls out of political life.
"US Open: Murray closing on win v Cerundolo, Edmund set down to Ruud",/sport/live/tennis/59071709,Tennis,"Follow live text updates and BBC Radio 5 Sports Extra commentary from day one of the US Open at Flushing Meadows, New York."
Spurs need more signings to compete - Conte,/sport/football/62717987,Football,Tottenham manager Antonio Conte feels Spurs need at least two more transfer windows to challenge for the Premier League title.
Kenyan cyclist Kangangi dies in crash,/sport/africa/62712921,Sport Africa,Kenyan cyclist Suleiman Kangagi dies following a high-speed crash in a race in the United States on Saturday.
The Ukrainian rock band that swapped guitars for guns,/reel/video/p0cv4kc5/antytila-the-rock-band-that-swapped-guitars-for-guns,,
The real reason the Spanish Armada was defeated,/reel/video/p0cwdfy8/the-reason-why-the-spanish-armada-failed,,
A simple exercise that gives your brain an unexpected boost,/reel/video/p09v8wyh/a-simple-exercise-that-gives-your-brain-an-unexpected-boost,,
How whiskey changes with the climate,https://www.bbc.com/future/article/20220826-how-whiskey-is-shaped-by-the-weather-and-climate,Future,"Temperature, humidity and pressure all affect the taste of whiskey"
The struggle with height discrimination,https://www.bbc.com/worklife/article/20220825-height-discrimination-how-heightism-affects-careers,Worklife,"Too short, too tall? How the ‘heightism’ bias sneaks into so many places"
10 TV shows to watch this September,https://www.bbc.com/culture/article/20220826-10-of-the-best-tv-shows-to-watch-this-september,Culture,Including Lord of the Rings and a controversial drama about Boris Johnson
India’s ancient quake-resistant homes,https://www.bbc.com/travel/article/20220825-kath-kuni-the-himalayas-ancient-earthquake-defying-design,Travel,"In the Himalayas, a centuries-old building style still defies earthquakes"
Gibraltar is officially a city - 180 years late,https://www.bbc.com/news/uk-62710553,UK,"The Rock's status was granted by Queen Victoria in 1842, but was omitted from official records"
The sudden silencing of Guantanamo's artists,https://www.bbc.com/news/world-us-canada-62399826,US,Artists are fighting to reverse a Trump-era policy that barred art from leaving Guantanamo
Charli XCX: I was always up for getting down and dirty,https://www.bbc.com/news/entertainment-arts-62690604,Entertainment & Arts,"Looking back at her career from illegal raves to stadium tours, the star wonders what next"
Why Auckland is the 'spongiest' city,/future/article/20220823-how-auckland-worlds-most-spongy-city-tackles-floods,,
The elephant buses safeguarding kids,/future/article/20220816-the-botswana-buses-tackling-human-elephant-conflict,,
The crab invading the Mediterranean,/future/article/20220809-how-the-mediterranean-became-the-worlds-most-invaded-sea,,
Swift announces new album as she wins top VMA,/news/entertainment-arts-62712148,Entertainment & Arts,The singer revealed details about her new record Midnights as she scooped video of the year.
Instagram says precise location is never shared,/news/technology-62686375,Technology,
Synthetic mouse embryo develops beating heart,/news/health-62679322,Health,
Firm denies turning call centre voices 'white',/news/technology-62633188,Technology,
Anger as presenter removed from Radio 4 show,/news/entertainment-arts-62712155,Entertainment & Arts,
Twitter and Meta take down pro-US propaganda,/news/technology-62674860,Technology,
"Be less squeamish over sewage water, says expert",/news/uk-62708413,UK,
"Knight, kite and butterflies: Photos of the week",/news/in-pictures-62686075,In Pictures,
A photographic mission to show us the Moon,/news/science-environment-62662685,Science & Environment,
Sunken medieval village reappears at reservoir,/news/uk-england-york-north-yorkshire-62677584,York & North Yorkshire,
"Africa's top shots: Revellers, robots and rioters",/news/world-africa-62672601,Africa,
Photographer heads home to shine light on refugees,/news/uk-england-tyne-62505144,Tyne & Wear,
