title,href,tag,summary
Valieva allowed to compete at Olympics,/sport/winter-olympics/60371282,News,Kamila Valieva is allowed to compete at the Olympics after the Court of Arbitration for Sport upholds a decision to lift the 15-year-old's provisional ban for a failed drugs test.
HMRC seizes NFT for first time in £1.4m fraud case,https://www.bbc.com/news/business-60369879,Business,
Dr Dre stars at Super Bowl and Eminem takes the knee,https://www.bbc.com/news/entertainment-arts-60354066,Entertainment & Arts,
The secret to successful TV reboots,https://www.bbc.com/culture/article/20220211-bel-air-and-what-makes-a-good-or-bad-tv-reboot,Culture,
The vaccine invented in a garden shed,https://www.bbc.com/travel/article/20220213-britains-miraculous-life-saving-garden-shed,Travel,
The day Canada's bridge protesters had dreaded,/news/world-us-canada-60364821,US & Canada,Police have cleared the costly bridge blockade at Windsor. Are two weeks of protests about to end?
Ukraine seeks meeting with Russia within 48 hours,/news/world-europe-60370541,Europe,"Ukraine accuses Russia of ignoring requests to explain its troop build-up, and calls for a meeting."
Rams beat Bengals for late Super Bowl win,/sport/american-football/60370985,American Football,The Los Angeles Rams score a late touchdown to beat the Cincinnati Bengals 23-20 in Super Bowl 56.
"Watch Winter Olympics day 10 - GB men seal curling win, Valieva allowed to compete",/sport/live/winter-olympics/57276800,Sport,Watch live coverage of two streams and follow text updates from day 10 of the Beijing 2022 Winter Olympics.
Premier League reaction,/sport/live/football/60372211,Football,"Reaction from all the weekend's Premier League games, plus hear from Graham Potter, Ralf Rangnick and Pep Guardiola."
'Six Nations title is France's to lose',/sport/rugby-union/60370785,Rugby Union,"France - the only unbeaten side in the Six Nations - are oozing confidence and are favourites to take the title, says former England scrum-half Matt Dawson."
The people who were fed to the sharks,/reel/video/p0bnhzc4/the-senegalese-island-with-a-doorway-of-no-return-,,
How identical twins reveal the truth about our nature,/reel/video/p0bn70nw/nature-vs-nurture-how-your-genes-shape-who-you-are,,
How copying this Swedish tradition can make you happier at work,/reel/video/p0bmzygz/the-swedish-tradition-that-can-make-you-happier-at-work,,
The X-rated musical that became a hit,https://www.bbc.com/culture/article/20220210-how-the-x-rated-musical-cabaret-became-a-hit,Culture,How Cabaret tackled Hollywood's last taboo
The people with 'hybrid' immunity,https://www.bbc.com/future/article/20220210-the-cells-that-can-give-you-super-immunity,Future,Memory B cells play a critical role in protecting people from serious illness
America's extreme subarctic road,https://www.bbc.com/travel/article/20220210-the-alaska-highway-a-subarctic-road-to-prevent-invasion,Travel,It was the most ambitious construction project since the Panama Canal
Why people believe in the soulmate myth,https://www.bbc.com/worklife/article/20220204-why-people-still-believe-in-the-soulmate-myth,Worklife,Why is it so hard to accept there may not be just one perfect person for you?
The 'guilt-free' eggs and dairy,https://www.bbc.com/future/bespoke/follow-the-food/the-search-for-carbon-neutral-protein/,Follow the Food,Non-meat animal products can have surprisingly high climate impacts
Quiz: Test your Super Bowl knowledge,https://www.bbc.com/sport/american-football/60302390,American Football,How will you get on in our Super Bowl special?
Underwater Photographer of the Year winner revealed,https://www.bbc.com/news/in-pictures-60334402,In Pictures,Rafael Fernandez Caballero is named overall winner for his image of whale sharks
The country embracing life on water,/future/article/20220202-floating-homes-the-benefits-of-living-on-water,,
The climate benefits of tiny islands,/future/article/20220131-the-worlds-tiny-islands-inspiring-green-action,,
How a desert city holds back its sand,/future/article/20220125-how-dubai-is-pushing-back-its-encroaching-deserts,,
Apple moves to stop AirTag tracking misuse,/news/technology-60333771,Technology,"The company will introduce a range of measures, after concerns AirTags were being used by stalkers."
Ghostbusters director Ivan Reitman dies aged 75,/news/entertainment-arts-60370984,Entertainment & Arts,
Bionic eye tech aims to help blind people see,https://www.bbc.co.uk/news/business-60316224,Business,
Modern star maps hint at famous wreck's location,/news/science-environment-60352606,Science & Environment,
Lessons in pleasure boost good safe sex,/news/health-60346008,Health,
White House left behind as states drop Covid rules,/news/world-us-canada-60328163,US & Canada,
Record high deforestation of Amazon in January,/news/science-environment-60333422,Science & Environment,
Your pictures on the theme of winter walks,/news/in-pictures-60319086,In Pictures,
Petals and lemons - photos from around the world,/news/in-pictures-60347907,In Pictures,
Africa's top shots: Gap-toothed smiles and snail dye,/news/world-africa-60331022,Africa,
In pictures: Crossing the world's deepest lake,/news/in-pictures-60219775,In Pictures,
'One gig changed the trajectory of my life',/news/uk-england-merseyside-60250029,Liverpool,
