title,href,tag,summary
"First phase of Ukraine war over, Russia says",/news/live/world-europe-60856533,Europe,"A senior military official has said Russia will focus on the complete ""liberation"" of Ukraine's eastern Donbas region."
Kim fronts Hollywood-style video to launch missile,/news/world-asia-60877578,Asia,
The PR missteps that overshadowed a royal tour,/news/uk-60870417,UK,
US lawmaker toppled by Nigerian billionaire cash,/news/world-us-canada-60876857,US & Canada,
West Indies edge into lead over England,/sport/cricket/60877712,Cricket,
Rowling hits back at Putin's 'cancel culture' comment,/news/world-europe-60878133,Europe,"Mr Putin referenced the Harry Potter author during a speech condemning ""cancel culture"" in the West."
Court hears of violent plot to abduct US governor,/news/world-us-canada-60876858,US & Canada,"A former co-conspirator said the accused plotters were seeking the ""ignition"" for a second civil war."
UK Covid infections climb by a million in a week,/news/health-60872687,Health,"About 4.3 million people - or one in every 16 - are thought to have the virus, compared to 3.3 million the week before."
The football scam that took Eriksson to North Korea,/sport/football/60794963,Football,In the summer of 2009 mysterious new owners promised to propel fourth-tier side Notts County to grand success. It was all a big lie.
Saudi GP to go ahead despite nearby attack,/sport/formula1/60880598,Formula 1,The Saudi Arabian Grand Prix will go ahead as planned after a missile attack on an oil facility near the track in Jeddah.
Egypt edge African champions Senegal in Cairo,/sport/football/60881814,Football,A fourth-minute own goal is enough to give Egypt a 1-0 win over Senegal in Cairo in their World Cup play-off.
How one of the world's most expensive spices is harvested,/reel/video/p0bpz9c7/how-one-of-the-world-s-most-expensive-foods-is-harvested,,
"A Nordic tale of 'sex, death, revenge and power'",/reel/video/p0bx78hx/why-we-are-still-living-in-an-old-norse-saga,,
The deadly toxin found in the world's oldest mummies,/reel/video/p0br366s/life-beyond-death-in-the-driest-place-on-earth,,
A vegan-loving city sued by McDonald's,https://www.bbc.com/travel/article/20220320-tbingen-europes-fiercely-vegan-fairy-tale-city,Travel,Will this fairy-tale town of the future prevail?
Oscars 2022: Who will win?,https://www.bbc.com/culture/article/20220324-oscars-2022-who-will-win-and-who-should,Culture,Our critics give their Academy Award predictions – and pick their favourites
The relationship taboo that won't die,https://www.bbc.com/worklife/article/20220317-age-gaps-the-relationship-taboo-that-wont-die,Worklife,Why can't people accept that some couples simply aren't close in age?
The alternatives to Russia's natural gas,https://www.bbc.com/future/article/20220324-how-biogas-can-help-europe-cut-russian-gas,Future Planet,"Food waste, farm sludge and sewage could find new life as sources of fuel"
What stops us from being kinder?,https://www.bbc.com/future/article/20220323-what-stops-people-from-being-kinder,Future,The Kindness Test explored reasons behind our hesitation
Queen's delight as teapot factory comes to her,https://www.bbc.com/news/uk-60869176,UK,The pandemic prevented her visiting the firm's factory in 2020
Mixed responses to second Bridgerton series,https://www.bbc.com/news/entertainment-arts-60872729,Entertainment & Arts,"The hit Netflix series is described as ""less fun"" with fewer sex scenes, but also ""more dynamic"""
The town that got up and left,/future/article/20220310-the-illinois-town-valmeyer-could-be-a-model-for-relocation,,
The homes powered by a kite,/future/article/20220309-the-kites-flying-to-harness-the-worlds-strongest-winds,,
Hong Kong's answer to landslides,/future/article/20220225-how-hong-kong-protects-people-from-its-deadly-landslides,,
Charli XCX scores her first number one album,/news/entertainment-arts-60879915,Entertainment & Arts,"The star's fifth studio album, Crash, was billed as an experiment in commercial pop. It worked."
Russia 'hacked Ukrainian satellite communications',/news/technology-60796079,Technology,
UK's rainfall records rescued by volunteer army,/news/science-environment-60860397,Science & Environment,
Stomach bug cases plummeted in UK's Covid lockdown,/news/health-60819716,Health,
Uber to list New York City yellow taxis in app,/news/business-60864889,Business,
Britain's loudest bird makes booming recovery,/news/science-environment-60863563,Science & Environment,
Rapper cleared of violent disorder incident,/news/uk-england-coventry-warwickshire-60881243,Coventry & Warwickshire,
US photographer Dirck Halstead dies at 85,/news/in-pictures-60878983,In Pictures,
"Africa's top shots: Quiffs, puppets and chapatis",/news/world-africa-60861605,Africa,
Laptop art: From Vans to Harry Styles,/news/in-pictures-60592677,In Pictures,
Aerial photos show 100 years of changing landscape,https://www.bbc.co.uk/news/articles/cv2l5x3n0mxo,News,
Africa's top shots: Easy riders and lollipop men,/news/world-africa-60777278,Africa,
