title,href,tag,summary
Titan sub CEO dismissed safety warnings as 'baseless cries',/news/world-us-canada-65998914,US & Canada,"Warnings over the sub's safety were dismissed by OceanGate's CEO, emails seen by the BBC show."
Wagner mercenary boss says Russia bombed his troops,https://www.bbc.com/news/world-europe-66005256,Europe,
Greece ignored offer to watch migrant boat - EU agency,https://www.bbc.com/news/world-europe-66003244,Europe,
Neves joins Saudi's Al-Hilal for club record £47m,/sport/football/66005040,Football,
The darker side of Disney songs,https://www.bbc.com/culture/article/20230622-the-darker-side-of-disney-songs,Culture,
Safety investigations launched into Titan sub deaths,/news/live/world-us-canada-65967464,US & Canada,Experts have raised concerns over the regulation of deep-sea vessels following the Titanic dive tragedy.
Moment missile strikes bridge to Crimea,/news/world-65999469,World,A bridge in Ukraine connecting southern Ukraine to the Crimean peninsula has been hit by missiles.
Dingo bites tourist sunbathing in Australia,/news/world-australia-65994828,Australia,"New video shows the moment a French woman was attacked by a dingo at a beach in K’gari, Australia."
Beaumont ton leaves tense Ashes Test in balance,/sport/cricket/65998774,Cricket,Tammy Beaumont's maiden Test century led England's emphatic fightback with the bat on day two of the one-off Ashes Test match at Trent Bridge.
Newcastle Utd close to signing AC Milan's Tonali,/sport/football/65982584,Football,Newcastle United are close to signing Italy midfielder Sandro Tonali from Serie A side AC Milan.
Man City or Arsenal? The race is on for Rice,/sport/football/65996802,Football,"As Manchester City and Arsenal look to sign Declan Rice from West Ham, BBC Sport look at where the England midfielder could fit in for both sides."
Our obsession with 'ugly-cute' animals,https://www.bbc.com/future/article/20230622-why-do-we-love-ugly-animals,Future,"They may look hideous to our eyes, but we still find them appealing"
Sweden's magical day of feasting,https://www.bbc.com/travel/article/20230622-a-celebratory-strawberry-cake-for-swedens-midsummer-festival,World's Table,"It's a celebration of seasonal dishes, fertility and the longest day of the year"
What professional women often sacrifice,https://www.bbc.com/worklife/article/20230620-why-many-women-prioritise-their-partners-jobs,Worklife,"""Even though I was really happy in my career and my life, I abandoned it"""
Hear from the Titan's crew before the tragedy,/reel/video/p0fwt2d3/hear-from-the-titan-s-crew-before-the-tragedy,,
"A 2,200-year-old mystery hidden in a Roman pie",/reel/video/p0fs0v85/a-2-200-year-old-mystery-hidden-in-a-pie,,
The tiny Scottish island still 'inhabited' by Vikings,/reel/video/p0cbfd0z/why-the-vikings-never-left-scotland,,
How dangerous is the Titanic wreck?,https://www.bbc.com/future/article/20230620-why-the-waters-around-the-titanic-are-still-treacherous,Future,"Expeditions 3.8km (12,500ft) beneath the waves faces many challenges"
Europe's most expensive painting ever?,https://www.bbc.com/culture/article/20230621-klimts-lady-with-a-fan-the-painting-thats-valued-at-65m,Culture,Gustav Klimt's final masterpiece
A unique safari through remote Brazil,https://www.bbc.com/travel/article/20230621-a-unique-safari-through-the-brazilian-pantanal,Travel,Explore the largest wetland on the planet on horseback
The Gen Xers making dream-career pivots,https://www.bbc.com/worklife/article/20230620-the-mid-career-workers-pivoting-to-dream-jobs,Worklife,"""To be 43, and say, 'OK, now I'm a podcaster' … almost sounds like make believe"""
Titan sub implosion: How did it happen?,https://www.bbc.com/news/world-us-canada-65934887,US & Canada,The Titan submersible suffered a violent collapse inwards deep underwater in the North Atlantic
'Never Have I Ever lets us represent Tamil culture',https://www.bbc.com/news/newsbeat-65978702,Newsbeat,The actors playing the characters of Nalini and Kamala discuss representing their culture
Police warn over new Android 999 call feature,https://www.bbc.com/news/technology-65962942,Technology,"Police say an update is bombarding operators with ""silent"" calls"
The homes built from cannabis,/future/article/20230614-the-buildings-constructed-from-cannabis,,
Finland's plan to bury nuclear waste,/future/article/20230613-onkalo-has-finland-found-the-answer-to-spent-nuclear-fuel-waste-by-burying-it,,
Could hosepipe drones tackle wildfires?,/future/article/20230609-can-we-use-firefighting-drones-put-out-wildfires,,
Trolleys spot hidden heart problems in shoppers,/news/health-65983627,Health,Special sensors in the handle can detect an irregular heartbeat that raises the risk of stroke.
"Masks, fighters and witches: Student photographers on show",/news/in-pictures-65960401,In Pictures,
Musk and Zuckerberg agree to hold cage fight,/news/business-65981876,Business,
Excitement builds as Arctic Monkeys to headline Glastonbury,/news/live/entertainment-arts-66000496,Entertainment & Arts,
Risk popular website sells forced labour goods,/news/business-65990529,Business,
Barbados PM leads fight for climate cash shake-up,/news/science-environment-65962997,Science & Environment,
Foo Fighters make 'surprise' return to Glastonbury,/news/entertainment-arts-66004466,Entertainment & Arts,
"Fans, foes and foil clothes: Africa's top shots",/news/world-africa-65967998,Africa,
Millinery masterpieces at Royal Ascot,https://www.bbc.co.uk/news/articles/c3g1e00xgy2o,News,
"Rihanna, Lizzo and Marilyn shine in Divas exhibition",/news/entertainment-arts-65949434,Entertainment & Arts,
Beauty of insects revealed in photo competition,/news/in-pictures-65876963,In Pictures,
Dazzling ancient bronze sword found in Germany,/news/world-europe-65936594,Europe,
