title,href,tag,summary
Russia starts grain shipments from occupied Ukraine,/news/live/world-europe-62006801,Europe,"Ukraine's government accuses Russia of stealing grain and blocking ports, contributing to global food shortages."
Missing Cryptoqueen joins FBI ten most wanted,https://www.bbc.com/news/world-us-canada-62005066,US,
Detained US basketball star appears in Russian court,https://www.bbc.com/news/world-europe-62011084,Europe,
Scotland's underground energy fortress,https://www.bbc.com/travel/article/20220630-the-mountain-that-helps-power-britain,Travel,
Are 'mass Zoom firings' the future?,https://www.bbc.com/worklife/article/20220630-zoom-firing-are-virtual-layoffs-the-future,Worklife,
Russian missiles kill 19 near Odesa - Ukraine,/news/world-europe-62006743,Europe,"The overnight strikes hit a residential building and a recreation centre in a village, officials say."
Smuggling 'big business' along US-Mexico border,/news/world-us-canada-62002299,US & Canada,"Big sums can lure truckers into ""dangerous"" smuggling attempts, says one cross-border driver."
Controversial Florida abortion ban blocked by court,/news/world-us-canada-62002298,US & Canada,A Florida judge has granted a temporary injunction against a law banning abortions after 15 weeks.
"Rain stops play after Anderson strikes twice - clips, radio & text",/sport/live/cricket/59013052,Cricket,"Follow live text, in-play clips and TMS commentary from day one of the rearranged fifth Test between England and India at Edgbaston."
"Wimbledon: Watson, Norrie & Djokovic in action on day five",/sport/live/tennis/58529256,Tennis,"Watch live coverage and follow text updates, radio and clips from day five of the 2022 Wimbledon Championships."
British Grand Prix first practice under way on wet track,/sport/live/formula1/58919907,Formula 1,Follow live text and BBC Radio 5 Live Sports Extra commentary from first and second practice at the British Grand Prix.
How a scandal in Kosovo led to the UN's first official 'informant',/reel/video/p0chw9r3/the-un-s-first-whistleblower,,
The English garden growing the world's deadliest plants,/reel/video/p0cj109h/the-deadly-plants-hiding-in-your-garden,,
The physics that suggests we have no free will,/reel/video/p086tg3k/the-physics-that-suggests-we-have-no-free-will,,
The six key lessons about hybrid so far,https://www.bbc.com/worklife/article/20220628-the-six-big-things-weve-learned-about-hybrid-work-so-far,Worklife,The hybrid work experiment has finally taught us a few concrete things
The books that no-one can read,https://www.bbc.com/future/article/20220630-the-norwegian-library-with-unreadable-books,Future,Why no living person is allowed to know their stories – apart from their authors
11 films to watch this July,https://www.bbc.com/culture/article/20220630-11-of-the-best-films-to-watch-this-july,Culture,Including the return of Jordan Peele and Thor
What happened to wild salmon?,https://www.bbc.com/travel/article/20220629-the-last-of-irelands-rare-wild-salmon,Travel,There are fewer and fewer with every passing year
Minecraft YouTuber Technoblade dies aged 23,https://www.bbc.com/news/entertainment-arts-62006852,Entertainment & Arts,"The popular gamer, who had been living with cancer, signed off by saying ""so long nerds"""
What will the next 25 years hold for Hong Kong?,https://www.bbc.com/news/world-asia-china-61948005,China,Doubt hangs over the future of one of Asia's most vibrant cities as it reaches a crucial halfway...
Zika may make humans more attractive to mosquitoes,https://www.bbc.com/news/health-62000243,Health,"Zika and dengue fever viruses alter the scent of humans and mice they infect, researchers say"
Why the world's tallest trees are dying,/future/article/20220623-the-genetic-power-of-ancient-trees,,
The promise of a world without roads,/future/article/20220621-what-if-roads-went-underground,,
The English town that welcomed the dark,/future/article/20220614-the-crusade-for-darker-night-skies,,
Nearly a quarter of Earth's seafloor now mapped,/news/science-environment-61986359,Science & Environment,An area broadly the size of Europe's land surface was added to ocean charts in the past year alone.
US firms pledge to pay abortion travel expenses,/news/business-61941591,Business,
EastEnders reveals first drag queen character,/news/newsbeat-62010839,Newsbeat,
UK must insulate to reduce energy bills - report,/news/science-environment-61926275,Science & Environment,
Amazon restricts LGBT goods in United Arab Emirates,/news/business-61991140,Business,
The world reacts to US abortion ruling,/news/world-us-canada-61788929,US & Canada,
Consumer groups criticise Google sign-up,/news/technology-61980233,Technology,
"Africa's top shots: Tasting, dancing and baking",/news/world-africa-61993604,Africa,
Photographers showcase Sutton Park's beauty,/news/uk-england-birmingham-61956587,Birmingham & Black Country,
V&A celebrates Africa's cutting-edge fashion,/news/world-africa-61878458,Africa,
Elusive street photographer's work debuts in UK,/news/uk-england-beds-bucks-herts-61887224,"Beds, Herts & Bucks",
"Africa's top shots: Stretch, bend, dive",/news/world-africa-61907505,Africa,
