title,href,tag,summary
Covid origin likely China lab incident - FBI chief,/news/world-us-canada-64806903,US & Canada,"Christopher Wray says the FBI has ""for quite some time"" settled on a potential lab incident in Wuhan."
Ruling party wins Nigeria's presidential election,https://www.bbc.com/news/world-africa-64760226,Africa,
Ukraine war casts shadow over India's G20 ambitions,https://www.bbc.com/news/world-asia-india-64781836,India,
China hits out as US bans TikTok on federal devices,https://www.bbc.com/news/world-asia-china-64795548,China,
The problem confronting women of colour,https://www.bbc.com/worklife/article/20230228-the-perfect-storm-keeping-women-of-colour-behind-at-work,Worklife,
Carnage after trains collide in northern Greece,/news/world-europe-64806678,Europe,"Two trains collide near the city of Larissa, killing at least 29 people and injuring dozens."
Trump lashes out at Murdoch over vote fraud case,/news/world-us-canada-64806437,US & Canada,"The media mogul's emails reveal he told a Fox executive: ""We want to make Trump a non person."""
LA agrees to pay Kobe Bryant widow almost $29m,/news/world-us-canada-64806905,US & Canada,"Vanessa Bryant said first responders took photos of her late husband's remains for ""morbid gossip""."
Blackburn 'write new chapter' in 'greatest' competition,/sport/football/64806400,Football,The euphoric contingent of Blackburn's travelling fans are now dreaming of a trip to Wembley after a deserved 2-1 victory at Leicester took their side into the quarter-finals.
Foden scores twice as Man City beat Bristol City,/sport/football/64788956,Football,"Phil Foden says he feels ""100% fit"" as his double sends Manchester City past Bristol City into the FA Cup quarter-finals."
"After the Bash at the Basin, bring on the Ashes",/sport/cricket/64776695,Cricket,"Even in defeat, England threw another party in honour of Test cricket in Wellington - now the Ashes countdown is on, writes Stephan Shemilt."
Huldufólk: The truth about Iceland's belief in hidden people,/reel/video/p0f5xqv0/hulduf-lk-iceland-s-mythical-world-of-hidden-people,,
The shocking legacy of the Dutch 'Hunger Winter',/reel/video/p0f5qzdq/the-harmful-legacy-of-poor-nutrition,,
Extreme Korean game stirs heated controversy,/reel/video/p0f56xr5/extreme-korean-game-stirs-heated-controversy,,
The return of the US' lost language,https://www.bbc.com/travel/article/20230228-kouri-vini-the-return-of-the-us-lost-language,Travel,"There are fewer than 6,000 speakers left"
The 1991 video game phenomenon,https://www.bbc.com/culture/article/20230228-street-fighter-ii-the-1991-video-game-that-packs-a-punch,Culture,Street Fighter II's unique cultural reach
A new way to navigate work and life,https://www.bbc.com/worklife/article/20230227-what-does-work-life-balance-mean-in-a-changed-work-world,Worklife,"As barriers between home and job collapse, what does work-life balance mean now?"
Why the world faces a 'genomic gap',https://www.bbc.com/future/article/20230227-the-search-for-the-worlds-missing-genomes,Future,We are missing the genetic information of most of the planet
The Greek meatballs packed with history,https://www.bbc.com/travel/article/20230228-soutzoukakia-the-greek-meatballs-packed-with-history,World's Table,Caroline Doriti's new cookbook shares the story behind this Greek comfort food
Why is Israel-Palestinian violence surging?,https://www.bbc.com/news/world-middle-east-64757995,Middle East,How come the Israel-Palestinian conflict seems to have suddenly got much worse
Ancient mummy found in delivery man's bag,https://www.bbc.com/news/world-latin-america-64797080,Latin America & Caribbean,"The Peruvian man said he wanted to show his friends the mummy, which is at least 600 years old"
The clothes you can't recycle,/future/article/20230227-how-to-recycle-your-clothes,,
How longer weekends help the planet,/future/article/20230220-is-a-4-day-workweek-good-for-the-climate,,
Can the unborn have a say on climate?,/future/article/20230215-should-future-generations-have-climate-rights,,
Jodie Comer and Paul Mescal up for Olivier Awards,/news/entertainment-arts-64795792,Entertainment & Arts,The most nominated show overall is the stage version of Studio Ghibli's animation My Neighbour...
Guilt-free flying not in easy reach - scientists,/news/science-environment-64788106,Science & Environment,
Spectacular northern lights seen across UK,/news/uk-64782372,UK,
YouTube accused of collecting UK children's data,/news/technology-64786968,Technology,
Blackpink lead top stars back on the road in Asia,https://www.bbc.co.uk/news/business-64286127,Business,
Daily walk prevents one in 10 early deaths - study,/news/health-64790527,Health,
What is carbon capture and can it fight climate change?,/news/science-environment-64723497,Science & Environment,
SAG Awards: The red carpet in pictures,/news/entertainment-arts-64781316,Entertainment & Arts,
Vigils and flags: Ukraine war anniversary in pictures,/news/in-pictures-64757068,In Pictures,
The 24-year photography project,/news/in-pictures-64723755,In Pictures,
Outlaw-themed parade triumphs at Rio carnival,/news/world-latin-america-64742729,Latin America & Caribbean,
"Chukkas, cats and candles: Africa's top shots",/news/world-africa-64726122,Africa,
