title,href,tag,summary
Russian diplomat quits over Putin's 'witless' war,/news/world-europe-61555390,Europe,"Boris Bondarev walks out of his job in Geneva, saying he has never been more ashamed of Russia."
Monkeypox outbreaks are containable - WHO,/news/health-61553822,Health,
I was forced to sign a false confession - Nazanin,/news/uk-61548645,UK,
Biden vows to defend Taiwan in apparent US shift,/news/world-asia-china-61548531,China,
Mbappe not ruling out Real Madrid move in future,/sport/football/61555450,European Football,
Iran vows revenge after colonel's assassination,/news/world-middle-east-61546145,Middle East,Sayad Khodai was shot outside his home - the latest high-level figure to be killed in Iran.
Stranger Things return ‘formulaic but fabulous’,/news/entertainment-arts-61547989,Entertainment & Arts,"Season four of the retro US sci-fi show has four-star reviews and maybe its ""scariest monster yet""."
Kim Jong-un seen without mask at state funeral,/news/world-asia-61550090,Asia,The North Korean leader attends the funeral of a top military official as the country faces a Covid outbreak.
Raducanu fights back to win on French Open debut,/sport/tennis/61557693,Tennis,British number one Emma Raducanu comes back from a set down to win her senior debut at the French Open against Czech teenager Linda Noskova.
Chelsea deal 'still has major hurdles to overcome',/sport/football/61559342,Football,"The government is set to approve Chelsea's £4.25bn sale in the next 24 hours but the deal still has ""major hurdles to overcome"", BBC Sport learns."
'Thomas' class told during weird week in Tulsa',/sport/golf/61557033,Golf,"Justin Thomas is a worthy winner of a second major title following a curious week in Oklahoma, writes Iain Carter."
Why healthy sleep is the key to 'great sex',/reel/video/p0c7rpjl/why-healthy-sleep-is-the-key-to-great-sex-,,
A revealing new look into Ghislaine Maxwell’s youth,/reel/video/p0c7xryl/the-intriguing-early-years-of-ghislaine-maxwell,,
Are we entering a new era in human evolution?,/reel/video/p0c7mwdn/are-we-entering-a-post-anthropocentric-era-,,
The grossest film of 2022?,https://www.bbc.com/culture/article/20220523-triangle-of-sadness-review-a-gross-vomit-filled-satire,Culture,"Our verdict on shocking new satire Triangle of Sadness, with Woody Harrelson"
The trap of unlimited paid time off,https://www.bbc.com/worklife/article/20220520-the-smoke-and-mirrors-of-unlimited-paid-time-off,Worklife,Having as much paid holiday as you want? Sounds great – until it's not
The archaeology of inequality,https://www.bbc.com/future/article/20220520-why-some-ancient-societies-were-more-unequal-than-others,Future,Changes in farming helped spark economic unfairness
The world's true cradle of chocolate,https://www.bbc.com/travel/article/20220522-belize-the-worlds-true-cradle-of-chocolate,Travel,"""Cacao is so important to our culture that it is our culture"""
What Didi's US exit says about China and Wall St,https://www.bbc.com/news/business-59737135,Business,The Chinese ride-hailing giant will quit Wall Street less than twelve months after its US market...
Why are kangaroos being spotted in India?,https://www.bbc.com/news/world-asia-india-61518058,India,The sighting has raised alarms over networks that smuggle exotic animals to India
Why 24 countries have sent troops to Mozambique,https://www.bbc.com/news/world-africa-61464431,Africa,"Mozambique is at the heart of a global battle for influence, even though its conflict has local..."
The batteries powered by gravity,/future/article/20220511-can-gravity-batteries-solve-our-energy-storage-problems,,
The UK’s disappearing village,/future/article/20220506-the-uk-climate-refugees-who-wont-leave,,
The hidden volcano beneath a city,/future/article/20220427-how-taiwan-discovered-an-active-volcano-on-its-doorstep,,
"Governments must subsidise food and energy, says IMF",/news/business-61523624,Business,Managing director Kristalina Georgieva says state subsidies can help with the cost of living.
Clearview AI fined for storing UK facial images,/news/technology-61550776,Technology,
Gene-edited tomatoes could soon be sold in England,/news/science-environment-61537610,Science & Environment,
As it happened: Heard lawyers decide not to call Depp as witness,/news/live/world-us-canada-61555078,US & Canada,
'Formidable' challenges as monkeypox spreads - WHO,/news/health-61546199,Health,
Explosive Tonga volcano 'surprisingly intact',/news/science-environment-61529290,Science & Environment,
Star Wars spacecraft designer Cantwell dies,/news/entertainment-arts-61547986,Entertainment & Arts,
The last generation of Nigeria's facial scars,/news/world-africa-61229617,Africa,
Africa's top shots: Putin masks and haystack heads,/news/world-africa-61507580,Africa,
Daughters of the soil: The value of women in agriculture,/news/in-pictures-60985943,In Pictures,
Photos of 1900s life found hidden behind wallpaper,/news/uk-england-hereford-worcester-61425923,Hereford & Worcester,
Mythological family photos win top prize,/news/in-pictures-61073684,In Pictures,
